id|text|experiencer|emotion|target|cause|selected
775142387|I'm a #Republican, but if I have to hear my mom talk about #Romney one more time, I'm going to stab myself with my bayonet.|Tweeter|disgust|my mom|I have to hear my mom talk about #Romney|True
772925098|Will Obama fire the person responsible for this statement? ... misguided individuals to hurt the religious feelings of Muslims |Tweeter|anger|not specified|hurt|True
775168524|haha @DickMorrisTweet Romney is going to have a great convention. It's going to be incredible. He should gain a 5 or 6 point lead. #GOP2012|Tweeter|anger|DickMorrisTweet|Romney is going to have a great convention. It's going to be incredible. He should gain a 5 or 6 point lead.|True
775168523|Nicki Minaj Fucked Up With That Mitt Romney Line, True Or Not.|Tweeter|anger|Nicki Minaj|Mitt Romney Line|True
775185304|@chrisrockoz You are an ASS! #GOP2012 #Forward2012|Tweeter|anger|chrisrockoz|You are an ASS!|True
775142386|Someone please tell me what 'Legitimate rape' is. i have to remember this just in case it spills over in SA society #smed12 #Romney|Tweeter|disgust|Someone|'Legitimate rape'|True
772925096|How u voting in this state with an out of state id How are u voting in January WTF is a liberam This is why #republicans look down on blks|Tweeter|anger|blks|WTF is a liberam|True
775185307| Mitt Romney wants to ban porn....fuck that nigga. Lmao I bet you watch it.|Tweeter|anger|Mitt Romney fuck that nigga|Mitt Romney wants to ban porn|True
775185306|@JedediahBila never knew Obama's plan either or should I say still don't. #allpoliticianstalkthesame #election2012|tweeter|anger|JedediahBila|never knew Obama's plan|True
775142385|Some people are so narrow-minded that they have to stack their prejudices vertically! Can you spell #GOP, #Fox #RWNJ, #NRA ??? #p2 #CTL|Tweeter|anger|Some people GOP, #Fox #RWNJ, #NRA|narrow-minded that they have to stack their prejudices vertically!|True
772925095|So disgusted with both political parties. Both Obama and Mitt make me sick.|Tweeter|disgust|not specified|not specified|True
775168526|Getting ready for an exciting speach with the #Democrats and #Obama #Obama2012|Tweeter|joy|not specified|speach with the #Democrats and #Obama|True
772925097|If I was running for president, I would take the millions and millions I dollars in campaign money and give it back to the people! #election|Tweeter|disgust|to the people|not specified|True
775185305|my niggas got enough white to build barack house.|Tweeter|anger|not specified|my niggas got enough whit|True
772662022|@LilCblackwell I strongly disagree with that. We'll see what you gotta say when Romney gets elected. Sorry you're ignorant and uninformed|Tweeter|anger|LilCblackwell|ignorant and uninformed|True
774393297| Anyone that believes Romney's presidency will be much different than Obama's presidency is simply delusional.. #thatisall|Tweeter|anger|Romney's presidency|presidency|True
774322328|Nothing's changed. #CIA still fund #Saudi #AlQueda #Jihadist thugs in #Syria despite orders from #President #Obama. Remember #9.11 Sameold.|Tweeter|anger|#Saudi #AlQueda|#CIA still fund #Saudi|True
773020755|I wouldd rather hang with Obama than be at work right now #fml|Tweeter|anger|Obama|rather hang with Obama|True
772687911|If your a republican you Fail at Life. #Democrats 2012 #Obama2012 #Forward X #Change|Democrat|anger|republican|republican|True
774380500|I'm really tired of the Obama&amp Romney ads flooding YouTube&amp Hulu.|Tweeter|anger|Obama& Romney|ads flooding YouTube& Hulu|True
773985046| Amen ! If obama lose, I'm packing ALL MY SHIT!! and moving to bikini bottom, fuck that|Tweeter|anger|obama|If obama lose|True
772673482|Mitt Romney got put on waivers by the #Illuminati and the #Republicans picked him up |Tweeter|anger|Mitt Romney|#Republicans picked him up|True
774322327|Obama bring tears to my eyes, I never thought this moment would come when we'll have a black president. #TeamObama #4MoreYears|Tweeter|joy|Obama+|black president #TeamObama|True
773997923|If Sister Simone Campbell and Bishops are on Obama's side #republicans need to see that Jesus would be a #Democrat !!|Tweeter|joy|Sister Simone Campbell Obama|Jesus would be a #Democrat|True
772673481|And the fact that people think Obama gonna lose to Romney is funny af.Romney is a fuckin retard.|Tweeter|anger|Romney|Obama lose to Romney|True
774330400|Mitt Romney AND Barack Obama full of shit. I don't know why everybody insist on taking sides &lt|Tweeter|anger|Mitt Romney Barack Obama|full of shit|True
773976255|At the #Inslee #President Clinton luncheon. Excited to listen to President Clinton speak!|Tweeter|joy|President Clinton|Clinton speak|True
773001183|#Republicans #Democrats  #Liars They don't know what it's like to struggle from #paycheck to #paycheck #NoRespect|Tweeter|anger|#Republicans #Democrats #Liars|#NoRespect|True
773037716|So excited to vote this upcoming election finally exercising my right to choose our next president #Obama|Tweeter|joy|president #Obama|election next president|True
773011494|Consider what the world would be now if Gore's presidency wasn't hijacked by Bush #elections 2012 #Republicans|Tweeter|anger|Bush #Republicans|Gore's presidency hijacked by Bush|True
772695218|I hate bringing #religion into things but I DO NOT want a Mormon #president #Problems|Tweeter|anger|Morman #president|#Problems|True
773037714|'studens just think everyones gonna pay for their schooling!' I hate #republicans. Get out of my workplace.|Tweeter|anger|#republicans|everyones gonna pay|True
774405807|Hmm @NJGovChristie bad mouths @JerryBrownGov yet Meg Whitman has record losses/layoffs @HP. She can't run a company let alone my state #GOP|Tweeter|anger|Meg Whitman|can't run a company|True
773001180|4 years ago losing 800,000 jobs/month, now gaining jobs every month for 30 straight months #4moreyears #staythecourse|Tweeter|joy|not specified|gaining jobs|True
774393294|Fuck #Democrats - Fuck #Republicans -- they are full of shit. So stop buying into the bullshit. You fucking retards.|Tweeter|anger|#Democrats #Republicans|stop buying into the bullshit|True
774372355|i still believe in @BarackObama . Yes you can AGAIN Mr President #usa #vote #obama #Romney #electionday|Tweeter|joy|@BarackObama|Yes you can Mr President|True
774380498|Obama Voter Says Vote for Obama... YES WE CAN AGAIN!|Tweeter|joy|Obama|Obama Voter|True
773020752|WHO IS THE ASSHOLE THAT DECIDE TO PUT SUPPORT OBAMA ADS ON MY PANDORA? Communist. #RomneyRyan2012|Tweeter|anger|OBAMA|SUPPORT OBAMA ADS|True
772681937|Time to read up on my presidential #bullshit gota get ready for #mrcarlson this weekend #democrats #obama #Horses|Tweeter|anger|#democrats #obama|presidential|True
772984890|I'm trynna get my braces before Re election, Romney might win and fuck shit up for me.|Tweeter|anger|Romney|Re election Romney|True
774405809|Fuck you united states govt. For signing the NDAA fuck you Obama you ain't nothing but a liar and fuck you NASA for not preparing us...|Tweeter|anger|govt. Obama|signing the NDAA|True
772687910|@truthteam2012 progress. Lets keep moving forward #Obamabiden2012|Tweeter|joy|#Obamabiden2012|progress|True
774393293|#RomneyRyan2012 takes away titty Tuesdays. #ChadReed2012 wants the public to be happy. #fuckromney #realtalk|Tweeter|disgust|#RomneyRyan2012|#ChadReed2012 wants the public to be happy|True
773020754|If You Old Enough To Vote You Betta , Cause Mitt Romney Tryna Take Away Foods Stamps .|Tweeter|anger|Mitt Romney|Take Away Foods Stamps|True
772991590|I hate #election years. Keep your ads off #youtube!|Tweeter|anger|#election years|ads off #youtube|True
773037715|OK camera man we get it you dig busty moms and their babies. Enough with the close ups already! #dnc2012 #ObamaBiden2012 #DEMS|Tweeter|disgust|camera man|dig busty moms and their babies|True
772673483|@OKCheesus THE PLUMBING IN OPERATION METRO MAKES NO SENSE AT ALL. OBAMA'S DOING SOME SHADY SHIT.|Tweeter|anger|Obama|PLUMBING OPERATION METRO|True
772977812|Sending my registration form TODAY! #obama|Tweeter|joy|#Obama|Sending my registration|True
773997919|You wouldn't face charges for throwing a Molotov cocktail at a house with a Romney/Ryan sign in their yard, right? Right.|Tweeter|anger|Romney/Ryan|Romney/Ryan|True
774380502|There is just no end to the Damage @BarackObama has done to #America. It's time to kick him out of the White House. #tcot #gop #teaparty|Tweeter|anger|@BarackObama|Damage @BarackObama to #America|True
774330403|#Election2012 My next biggest question Do Republicans still own ALL the voting machines? REALLY?!? #ConflictOfInterest #Stealing #Idiots|Tweeter|anger|Republicans|own ALL the voting machines|True
773976256|This world is hell whether Obama is re-elected or Romney wins. #election2012|Tweeter|fear|Obama Romney|#election2012|True
774330399|@TichinaArnold gotta luv It... So... is Bin Laden better off now then he was 4 years ago? #4moreyears|Tweeter|joy|Bin Laden|Bin Laden better off|True
773020753|ahaah these #Obama&ampRomney pictures be having me laughing !|Tweeter|joy|#Obama&Romney|#Obama&Romney pictures|True
772984889|Funny how all the tweeps pissed at #Obama for declining a meeting request with Netanyahu are racist Conservatives.|Tweeter|anger|conservatives|racist Conservatives|True
774405811|Our economy has been fucked since #President Nixon|Tweeter|anger|#President Nixon|Our economy|True
772687913|Mitt Romney's such a fucking douche.|Tweeter|disgust|Mitt Romney|fucking douche|True
766247304|@gallupnews! Don be biased! Include @JillStein2012 in your #Election2012 polling!|tweeter|joy|jill stein|not specified|True
766247302|people living of the goeverment fucking bums and my tax money goes for these bums, i hope mitt romney wins #Republicans all day|tweeter|anger|government|tax money|True
769214049|Is Romney really president material? Tell me what u think. We dont make $200,000 a year but we pay taxes and he pays? We r poor in his eyes.|Tweeter|anger|not specified|dont make $200,000 a year|True
766377274|(2 of 2) And buying JUNK FOOD, with those EBT cards. Already 300+ lbs. Our tax dollars hard at work! #Socialism #Democrats #Obama|tweeter|disgust|not specified|not specified|True
771686182|MT @crimmigration #Romney's mom on George Romney's Mexican refugee past. Mitt's father's dependence on welfare. #Democrats sound like...|Tweeter|anger|Romney|not specified|True
775195079|I'm going to start saying Henry Merritt Paulson THE THIRD with the same disdain as the Barack HUSSEIN Obama people.|Tweeter|anger|not specified|not specified|True
769214051|And the fact that people think Obama gonna lose to Romney is funny af.Romney is a fuckin retard.|Tweeter|disgust|not specified|people think|True
766377270|Voting Republican because Obama hasn't done all you've expected, is like hiring a pedophile to watch your kids because the sitter was late.|Tweeter|anger|not specified|Voting Republican|True
771686183|obama run the gov right fuk him ...say it twitter fuk obama campaign.and fuk im gettin kiked out 4 kik the nigga out that pushed your dauter|Tweeter|anger|obama|obama campaign|True
766384925|What I learned from SuperPac ads Mitt Romney likes to hunt sick Steelworkers' wives for sport from atop his dressage horse, Refalka.|Tweeter|disgust|not specified|not speicified|True
766384924|Maggie Brooks and Louise Slaughter need to get off my television. Please and thank you. #election2012 #mudslinging|Tweeter|anger|Maggie Brooks and Louise Slaughter|not specified|True
775195075|If niggas vote fah romney man we all fucked smh.. please|Tweeter|disgust|niggas|vote fah romney|True
775195078|What? People are waiting in line at the MACC for #Obama right now? Can I have your class schedule and free time?|Tweeter|anger|not specified|wiating in line to vote for obama|True
769177866|@Btrswet I see! haha #Forward2012 #Obama2012 #4moreyears|Tweeter|joy|Btrswet|4moreyears|True
769381020|WHO IS THE ASSHOLE THAT DECIDE TO PUT SUPPORT OBAMA ADS ON MY PANDORA? Communist. #RomneyRyan2012|Tweeter|anger|not specified|support obama ads|True
766377271|#MyHomelessSignWouldSay VOTE FOR OBAMA OR BE PREPARED TO SEE ALOT MORE SIGNS LIKE THIS!!!|Tweeter|fear|not specified|not specified|True
766247301|I have honestly goota say, I don't like what I see at all for this next #election! #dumasses across the board|tweeter|anger|not specified|not specified|True
769214053|Feel like throwing a #DNC party tonight to watch Obama's speech. Will save that for when he wins! #4moreyears|Tweeter|joy|not specified|Obama's speech|True
770312427|Playing the find the minority in the #RNC Convention drinking game. WOW I have never been this sober in my life. #GOP|Tweeter|anger|not specified|find the minority|True
768236141| Anyone that believes Romney's presidency will be much different than Obama's presidency is simply delusional.. #thatisall|Anyone that believes Romney's presidency|disgust|Anyone that believes Romney's presidency, different than Obama's,|Anyone that believes Romney's presidency will be much different than Obama's presidency|True
768309939|BaRack em rack Obama , smfh . Kids watch the bullshit|tweeter|disgust|not specified|Obama|True
768309940|This is MY President! So deal with it! #4MoreYears #Obama2012 http//t.co/4BW7U6vN|tweeter|joy|not specifed|This is MY President! #Obama2012|True
768341006|@JedediahBila Yes. It was a funny start to an awesome rally in Powell, OH today. #RomneyRyan2012|tweeter|joy|tweeter|awesome rally in Powell, OH today.|True
768341005|#Republicans are comedic GOLD this election year lol #obama2012|tweeter|joy|Republicans|Republicans are comedic GOLD|True
768257262|@MittRomney Welcome back to Westerville and the Buckeye state. Looking forward to a great rally! #RomneyRyan2012|Tweeter|joy|Westerville and the Buckeye state.|Looking forward to a great rally!|True
768257261|@CameronCulp12 you expect obama to know the full damage of nationwide economy, shift no blame to bush who could have prevented during 04-07|tweeter|anger|not specified|expect obama to know the full damage of nationwide economy, shift no blame to bush|True
768289389|At the #Inslee #President Clinton luncheon. Excited to listen to President Clinton speak!|Tweeter|joy|tweeter|Excited to listen to President Clinton speak!|True
768379880|Will Obama fire the person responsible for this statement? ... misguided individuals to hurt the religious feelings of Muslims |Muslims|disgust|misguided individuals|religious feelings|True
768257260|If You Old Enough To Vote You Betta , Cause Mitt Romney Tryna Take Away Foods Stamps .|Tweeter|fear|If You Old Enough To Vote|Mitt Romney Tryna Take Away Foods Stamps .|True
768289390|Barack Obama has more respect for illegal aliens and terrorists than he does for American entrepreneurs. (taken from a tweet by JayDavis)|Tweeter|anger|not specified|Barack Obama more respect for illegal aliens and terrorists for American entrepreneurs.|True
768236142|#Republicans #Democrats  #Liars They don't know what it's like to struggle from #paycheck to #paycheck #NoRespect|Tweeter|anger|#Republicans #Democrats|#Republicans #Democrats n't know what it's like to struggle|True
768289392|When #Romney says #Obama got every piece of legislation passed that he wanted, Romney sounds dumb. Right #CNN #MSNBC #FOX|Tweeter|anger|tweeter|#Romney says #Obama got every piece of legislation passed |True
766306924|Nobody wants to fuck Obama Brock he as ears like an elephant and that not the part everybody wants lol|tweeter|anger|Obama|not specified|True
769655479|Women are sensitive, yes. Women are emotional, yes. WOMEN SHOULD LEAD, YES. Men are innately strong, muscular, and territorial. #president|tweeter|joy|unspecified|I think they are saying anyone should be considered for president.|True
769655481|Mitt Romney has been caught in so many lies publicly its ridiculous...and Paul Ryan is just an imbecile.. #MyOpinion|tweeter|anger|Unspecified|Mitt Romneys lies|True
774209441|And all these bitches is my sons Yeah C-Section . I a Republican voting for Mitt Romney , you lazy bitches is fucking up the economy|tweeter|anger|unspecified|opinion on who is messing up the economy|True
766306926|Rr-electing Obama would be like backing the titanic up and hitting the Ice burg again.|Tweeter|anger|not specified|Rr-electing Obama|True
767166971|the Romney administration has to be the poorest most inconsistent presidential campaign in the last century. #republicans #sad|tweeter|anger|Grand old Party|the poor campaign run by Romney|True
769655477|People don't understand if Romney is elected there goes our medical marijuana and any chance of legalization #fuckromney #Obama|tweeter|anger|unspecified|The fact that some people do not understand what Romney will do if elected.|True
774153419|@TwitchyTeam - that's fair the rest of us aren't satisified with Obama's manipulated certificate of live birth.|tweeter|anger|Obama's manipulated certificate of live birth.|Obama's manipulated certificate of live birth.|True
774165370|Officially registered to vote in Chapel Hill! #RomneyRyan #GOP2012|tweeter|joy|registered to vote RomneyRyan|not specified|True
774153421|Ryan keeps talking about keeping our country free, but keeps forgetting the shackles he has in his BMW for women. #GOP|tweeter|anger|Ryan|keeps forgetting the shackles he has in his BMW for women.|True
774147603|Polls are stupid. These two clowns haven't even debated yet. #election2012|tweeter|anger|polls|two clowns haven't even debate yet|True
774147601|oh shit my son barack got bill clinton on the campaign commercial lol|tweeter|joy|my son barack got bill clinton|my son barack got bill clinton|True
774174553|Chef boyardee vs world hunger fuck it we feeding the world sponsored by #Obama|tweeter|anger|world hunger|not specified|True
770589778|@Btrswet I see! haha #Forward2012 #Obama2012 #4moreyears|tweeter|joy|Barrack Obama|4 more years|True
774174550|@Motter241 lol now I hope Mr Romney gets voted in so a year from now when were in the same shitty economic position I can say 'i told ya so'|tweeter|disgust|Romney|not specified|True
774147605|Gay porn If Romney wins this election, I'm just going to stay inside my home and watch porn for the next four years straight.|tweeter|disgust|Mitt Romney|not specified|True
774165368|I need to register to vote ! ... coss if #ROMNEY is elected we all Miight die !|tweeter|fear|ROMNEY|not specified|True
770617546|finally a registered voter! #betterlatethannever #election2012|tweeter|joy|voter|betterlatethannever election2012|True
770589785|once again 140 characters are not enough. i want to rant about how shitty romney is as a candidate and as a person.|tweeter|disgust|Mitt Romney|not specified|True
770617545|We're really excited because this week is Proud to Be a Democrat Week on campus! We have a lot of exciting events planned! #gobama #dems2012|tweeter|joy|Proud to Be a Democrat Week|gobama|True
770602043|Mitt Romney Aint pay no tax|tweeter|anger|mitt romney|no tax|True
770602040|I have honestly goota say, I don't like what I see at all for this next #election! #dumasses across the board|tweeter|disgust|#election! #dumasses|not specified|True
774147602|#Obama saying business owners didn't build their own companies is like saying @MichaelPhelps didn't win all those Gold Medals on his own.|tweeter|anger|Obama|Obama|True
774174554|(2 of 2) And buying JUNK FOOD, with those EBT cards. Already 300+ lbs. Our tax dollars hard at work! #Socialism #Democrats #Obama|tweeter|disgust|junk food EBT cards|not specified|True
770602042|I don't like when people think their only options are Obama or Romney. Those aren't the only two running for president.|tweeter|anger|when people think their only options are Obama or Romney|Those aren't the only two running for president.|True
774165371|i heard they was blowing down on Nicki Minaj on the radio this morning for saying vote for Romney. People then said way worst shit. GOHD !|tweeter|anger|they waspeople then said way worst shit|not specified|True
770602041|@barackobama @obama2012 When in doubt, Bombard a Muslim Country.. #Quote #Obama|tweeter|disgust|not specified|not specified|True
775623372|@chrisrockoz You are an ASS! #GOP2012 #Forward2012|tweeter|disgust|@Chrisrockoz|the tweeter does not care for @chrisrockoz|True
775607850|This country is disgusting!!! #RomneyRyan2012|Tweeter|anger|The nation|distrust of the way the country is headed|True
775632314|This is MY President! So deal with it! #4MoreYears #Obama2012 http//t.co/4BW7U6vN|Tweeter|joy|the general public|the tweeter is supportive of President Obama|True
775645215|I'm pumped to see mitt romney today!! #election2012|Tweeter|joy|Romney|The tweeter is excited to see Mitt Romney|True
773868255|We're really excited because this week is Proud to Be a Democrat Week on campus! We have a lot of exciting events planned! #gobama #dems2012|tweeter|joy|President Obama|Event- Democrat week|True
775632313|Obama bring tears to my eyes, I never thought this moment would come when we'll have a black president. #TeamObama #4MoreYears|Tweeter|joy|Obama|the tweeter is supportive of President Obama|True
771781638|obama run the gov right fuk him ...say it twitter fuk obama campaign.and fuk im gettin kiked out 4 kik the nigga out that pushed your dauter|tweeter|disgust|Obama|Kicked out of his house|True
774115926|#BarackObamaIs The President Of The United States &amp Should Be For 4 MORE YEARS #OBAMA !!!|Tweeter|joy|Barack Obama|Obama's reelection|True
771781634|Don't forget to register to vote! #natlvoterreg day! #vote #election2012|tweeter|joy|eligible voters|Reminding people to vote|True
771664042|#Romney is only playing tribute to @RonPaul in attempt to steal his voters away from Gary Johnson. #GOP fearing #Libertarian influence.|Tweeter|fear|The Republican Party|Romney's treatment of Ron Paul|True
771708873|@davidaxelrod for me this election is about good VS evil,.and Obama is evil incarnate and so are you and the rest of you Communists.|tweeter|anger|Obama and his supporters|Obama and the election|True
771708871|I don't like when people think their only options are Obama or Romney. Those aren't the only two running for president.|tweeter|anger|Apathetic voters|the fact that people don't consider other candidates|True
774115925|They dress in suits and lie their asses off. #republicans #talkingpolitics|tweeter|anger|republicans|not specified|True
774115922|School time. #BBL  &amp don't forget to watch #CNN tonight, the BIG debate, this one is gonna be soooooo good!!! #ObamaBiden2012|tweeter|joy|vlters|debate|True
771781635|We're really excited because this week is Proud to Be a Democrat Week on campus! We have a lot of exciting events planned! #gobama #dems2012|tweeter's group|joy|Students on campus|Proud to Be a Democrat Week|True
771781637|@BettyMWhite How can u support that shitty president Obama? Are you all that stupid in California and New York!!|tweeter|anger|@BettyMWhite|Someone supports Obama|True
773216425|Barack Obama's abbreviation is so funny - BObama #smile|tweeter|joy|obama's nick name|obama's nickname|True
773216423|These #democrats at the convention JAMMIN' and actually on beat #proud lol|tweeter|joy|democrats|democratic national convention|True
773216424|@realDonaldTrump keep it up Mr. Trump!! I live your takes and think USA needs more realism!! #romney|tweeter|joy|Donald Trump|Donald Trump|True
774115924|Mannnnnn i'll tell you this... if Barack EVER raised his voice like that to Michelle I'd bet money she would've Ochocinco'ed him...|tweeter|surprise|Obama|Debate|True
775318413|people are so ignorant. You want Obama out of office so badly but yet do you even know the policies he has? Do you even know Romney's?|tweeter|disgust|people|You want Obama out of office so badly but yet do you even know the policies he has|True
775318409|I'm really tired of the Obama&amp Romney ads flooding YouTube&amp Hulu.|tweeter|anger|Obama& Romney ads|flooding YouTube& Hulu|True
775285155|Some people boycotted a pizza parlor because the owner bear hugged Obama #ThatsSomeRepublicanShit|tweeter|anger|#ThatsSomeRepublicanShit|Some people boycotted a pizza parlor because the owner bear hugged Obama|True
775226406|Saw a headline on my phone that Obama is leaning toward Ryan's education plan...Say WHAT? WHAT? Me thinks I just saw a pig flyin'|tweeter|surprise|Obama|Obama is leaning toward Ryan's education plan|True
775300915|what is the best way to dilute a message? repeat it over 9000 times #obama #anonymous #election #ows #etc|tweeter|anger|#obama #anonymous #election #ows #etc|not specified|True
775344440|who ever it is ....we will still have a idiot who runs our country #election #endoftheworld|tweeter|anger|who runs our country|not specified|True
775344442|#Romney getting pummeled like Victor Ortiz!!!!! Go team #Castro|tweeter|joy|#Romney|#Romney getting pummeled|True
775258840|#Obama should bomb #Iran, NOW! Iran must NOT have nukes! It executes child rape victims 4 'adultery'! It is NUTS!!!|tweeter|anger|#Iran|Iran must NOT have nukes|True
775318411|I'm tired of hearing about Obama vs Romney and Romney vs Obama from people that don't know what they're talking about|tweeter|anger|people that don't know what they're talking about|not specified|True
775318412|Obama's first term is a complete failure. Anyone who votes for proven failure is uniformed, brain-dead or a loser.|tweeter|anger|Anyone who votes|Obama's first term is a complete failure|True
775258839|Literally dreading campus tomorrow #obama #president #craziness|tweeter|fear|campus|#obama|True
775226407|Fuck #Democrats - Fuck #Republicans -- they are full of shit. So stop buying into the bullshit. You fucking retards.|tweeter|disgust|republicans, democrats, voters|not specified|True
776005301|#obama How freaking exciting is this?? Make the cap fit the head.|Tweeter|joy|#obama|not specified|True
