id|text|experiencer|emotion|target|cause|selected
795905241|@billmaher When is someone going to praise @MittRomney and the LDS for their great and socialist tithing system? #Mitt2012 #Seriously|Tweeter|anger|MittRomney and the LDS|anger|True
795455568|Most people voting for Obama have no clue what they're voting for #RomneyRyan2012|Tweeter|disgust|democrates|voting|True
795917798|Great interview with Iranian pres,good insight on why Romney is lagging, @FareedZakaria never dissapoints|Tweeter|anger|Romney|anger|True
795434567|#Republicans, you should be working today! Unions brought us this holiday, among many other wonderful things like weekends.|Tweeter|disgust|Republicans|anger|True
795434566|Some people can't handle the truth, you can tell by vile crap spewing from their mouth after the facts are given. #truth #RomneyRyan2012|Tweeter|anger|people|anger|True
795477181|Ok lets talk about these white #republicans throwing peanuts at the BLACK CNN camera woman.|Tweeter|anger|republicans|anger|True
795471171|If Romney gets elected and Bibles start disappearing I know what time it is lol. Do you??|Tweeter|anger|Romney|anger|True
795471173|i walked past a girl sitting at a vote for romney table. almost got upset but then i realized somebody has to vote for him lol|Tweeter|anger|romney|anger|True
795471172|The teacher thinks im gonna watch that Obama shit. Hahah not happening|Tweeter|anger|Obama|anger|True
795465407|@pmadamdavidson Greg Mankiw wouldn't know whether or not Romney was discussing the ideas of Hayek - Mankiw has read NO Hayek besides RtoS.|Tweeter|anger|Romney|anger|True
795917802|Why the fuck do they care if women use birth control or get abortions?! It isn't their body, so it isn't their decision! #election #politics|Tweeter|anger|politics|anger|True
795477180|@K104FM DeeDee so uhm Nicki Minaj says she supports Mitt Romney.. she ain't that rich! Me lmao.. LOL.. haha.. *dying of laughter*|Tweeter|anger|Mitt Romney|anger|True
795455569|Please don't get me wrong, I hate all politicians. The media coverage of the strip clubs in Tampa just leaves the #GOP wide open.|Tweeter|anger|GOP|anger|True
795905243|This is the most egregious thing I've ever heard a politician say #Republicans #GOP #LegitimateRape #IllegitimateRape|Tweeter|anger|Republicans|anger|True
795434565|@MobileMollusk I love the trains. When Obama first started talking about high speed rails?! I'm so down for that.|Tweeter|joy|Obama|joy|True
795465405|@homerosimpsone MITT ROMNEY TIED HIS DOG TO THE ROOF OF HIS CAR FOR A FAMILY VACATION AND DROVE LIKE THAT ALL DAY|Tweeter|disgust|MITT ROMNEY|anger|True
795905240|Don't forget to vote in the #AZ #primary #election today for #prochoice #Democrat #women! Your voice matters and your vote counts!|Tweeter|joy|Democrat|encouragment|True
795917800|Ew. My grandma likes Romney. Ew ew ew. Am I related to her. Ew.|Tweeter|disgust|Romney|anger|True
795465406|#romney doesn't like vagina or art. The 2 things that make our world go round. Art funding! Women's rights! His dick is all poop covered eww|Tweeter|anger|romney|anger|True
795465408|Don't Be Mad When #obama loose.. Just Go Beat Your Friend Ass Who Talking About They Aint Gone Vote..|Tweeter|anger|Friend|anger|True
795917799|If Mitt Romney gets elected, There is no hope for the USA. #obama|Tweeter|anger|Mitt Romney|anger|True
795477183|The hours hookers put in at these US conventions are long and tiring but neither Romney or Obama thanked them. SAD! #gop2012 #dnc|Tweeter|anger|Romney or Obama|anger|True
794855591|@averyT10 didn't really happen...he has been dead for years before that...its was just a political tactic for #Obama...|tweeter|fear|obama|its was just a political tactic|True
795966558|Digusting behaviour at the #republicans conference in Tampa|tweeter|disgust|republicans|Digusting behaviour|True
795904044|Note one person has told me why they are voting for obama hahahhahahahhhha|tweeter|surprise|obama|why they are voting for obama hahahhahahahhhha|True
794106197|@gretawire Obama has failed America, and failed miserably. WAKE UP AMERICA!!! WHERE IS THE OUTRAGE? OBAMA MUST GO.|tweeter|anger|Obama|Obama's agenda|True
793892664| @MrBowMan Oh you crazy ass republicans...how you make me laugh so hard. Stop stop please stop my side hurts too much #GOP #cracknup|tweeter|joy|GOP|republicans and the way they are acting|True
794288595|Hope sending 200 Marines 2Guatemala w/o congressional approval will b on the House Judical agenda as a BO power abuse. #GOP|tweeter|anger|Obama|Sending 200 marines to Guatamala|True
795705457|#GOP2012 I love @MichelleObama great speech tonight!! #DNC|tweeter|joy|Michelle Obama|Michele Obama's speech at the DNC convention|True
793855964|Truly Obama's Jimmy Carter moment attack by Muslims on US embassy &amp US president responds w/ weakness &amp stupidity|tweeter|disgust|Obama|Obama's response to attack on US embassy|True
795730602|@BarackObama for president ! #4moreyears|tweeter|joy|Obama|loving Obama|True
795657789|Beyonce and Jay Z had a $4m dollar meal with Barack Obama. That has to be the most expensive KFC in history|tweeter|disgust|Obama|the election fundraiser dinner|True
795637967|#GOP needs professional counseling They deny climate change, evolution, Obama is US citizen, changing demographics. #losingtouchwithreality|tweeter|disgust|GOP|GOP Agenda|True
794090980|Id be less critical of mitt if he actually gave specifics in his political speech of how he'll turn things around rather than trash Obama|tweeter|anger|Romney|Mitt ROmney not defining his agenda|True
795705458|#romney doesn't like vagina or art. The 2 things that make our world go round. Art funding! Women's rights! His dick is all poop covered eww|tweeter|disgust|Romney|dislike of Romney agenda|True
795345641|I so can't stand Dan Rather, @BarackObama never talks down to me at all. All you old men have to get in your dig at the #President! #Maddow|tweeter|disgust|Dan Rather|a comment by Dan Rather about Obama|True
794076565|#VoterFraud I'm not #Surprised. This #Election will be rigged. It's a shame #Politions can't be honest. It's all about #Money.|tweeter|disgust|politicians|voter fraud|True
794090976|I don't understand why ppl are depending on one person #President to create our jobs when we should make a stand for ourselves|tweeter|disgust|Obama|not specified|True
794117005|@GroverNorquist You are a lunatic! I can't to see you #Republicans fail|tweeter|disgust|Republicans|the tweeter thinkd Govenor Norquist is a lunatic|True
795705456|If Romney become the president its only right if I shoot his ass|tweeter|disgust|Romney|dislike of Romney|True
795348450|ObamaNation has turned into an abomination very very quickly. #RomneyRyan2012|tweeter|anger|Obama|the election|True
795669044|@AriDavidUSA @sweetey15 NO!! That's why we DON'T date #Republicans #idiot! WHY do u think they h8 women so much?? TINY DICKS!! #GOPFail|tweeter|disgust|GOP|republican agenda|True
793855967| As national debt passes $16 trillion, GOP blasts Obama's policies #Campaign2012 What about those two unfunded wars?|tweeter|surprise|GOP|National debt passing 16 million|True
793899953|@EvanYar anyone who disagrees with pro-choice should go back to 1960 Jim Crowe laws... Then again most #republicans would probably like that|tweeter|disgust|Republicans|not specified|True
795730605|I've said it before, and I'll say it again....MY body, MY choice #PaulRyan #MittRomney #RNC #Republicans. Until men can bear children, STFU!|tweeter|anger|Romney|Romney's anti choice agenda|True
794137725|This fall will cherry-pick out-of-context data 2 arrive @ conclusions they came to before ever looking at said data. #election|tweeter|disgust|the media|not specified|True
795669048|@RepToddAkin please do all of us Republican's a favor and resign your nomination. Your comments are hateful and hurtful. #GOP2012|tweeter|disgust|Todd Akin|comments of the representative|True
795342319|I hope all you niggas dats standing n line dis damn late b standin n line ta vote #ThirstyAsses #Obama|tweeter|fear|Obama|the election|True
794117006|Truly elegant symmetry between Romney's domestic &amp international ineptitude.|tweeter|disgust|Romney|not specified|True
793907377|Precious metals keep going up and up and the #USDollar keeps going down and down. Great work #Democrats ( #DNC #RNC #GOP2012 #Democraps|tweeter|disgust|Democrats|not specified|True
795337256|First two commercials on TV are negative political ads. #election2012 #keepitpositive|tweeter|anger|negative campaign ads|negative campaign ads|True
794208866|Roll on Autumn! #AmericanElection #Obama #MittWRONGney|tweeter|joy|Obama|election|True
795637964| Romney dedicated to the principle that women &amp gays need regulation, but Wall Street doesn't. #GOP2012 #Forward2012 #genius|tweeter|disgust|Romney|Romney agenda|True
794174218|Not knowledgable with politics, but Obama's speech @ the DNC was nothing short of inspring , powerful, and true #4moreyears|tweeter|joy|Obama|Barack Obama's speech at the DNC|True
794167148|3.81$ for diesel what the fuuuck is going on! Fucking obama|tweet|disgust|Obama|price of gas|True
794297962|@hratcliff @ilanakats Oh absolutely. There'sa chapter about Romney and Obama + tricks used by both sides on and off the stump!|tweeter|anger|politicians|the election and Tricks used by both|True
794297960|Politics, as dirty as it looks, Obama and his team are setting great examples making it look like child's play.|tweeter|disgust|Obama|the election|True
795766814|Waking up for the #gop #RNC2012 this is way to early!|tweeter|anger|GOP|helping or asssisting with some GOP activity|True
795657791|Fuck the doomed. - #RomneyRyan2012|tweeter|disgust|obama supporters|not specified|True
794288593|RT @Babbidy Absolutely cannot wait to vote. #RomneyRyan2012|tweeter|joy|tweeter|Election 2012 ready to vote|True
794097233|@MorningJoe The appropriate toy 4 Romney is not an Etch A Sketch its Silly Putty. He will take on any form given to him by a misguided GOP.|tweeter|disgust|Romney|Romney changing his mind on items|True
795337257|Sheesh! All the DNC speakers are reciting the same handful of anti-Romney attacks like low job creation with a 4.6% unemployment rate!|tweeter|anger|DNC speakers|anti Romney attackers|True
794174219|@obama seems like your very good at lying or pleasing whatever setting or crowed your addressing what a great #president|tweeter|disgust|Obama|not specified|True
794236739|As someone that had #breastcancer, I resent Ann Romney for using her breast cancer for manipulative campaigning. #Decision2012|tweeter|disgust|Anne Romney|Ann Romney tlaking about her breast cancer|True
795766811|Why is all of mitt romneys shit showing up in my news feed? #idontlike #democrats #forever @emilykuebler|tweeter|anger|Romney|Romney information in news feed|True
795622303|Nothin jazzes me up like a good speech from Barack Obama. Sorry Romney supporters #4moreyears|tweeter|joy|Romney supporters|Obama's speeches|True
794081650|@uongozi254 i personally think that among those on the front page of today's #nationpaper none deserves to be #PRESIDENT|tweeter|disgust|politicians|not specified|True
794081653|Gosh Barack and Michelle Obama need to stop emailing me and telling me about their personal lives #ICouldCareLess #JunkMail|tweeter|disgust|Obamas|massive quantites of email|True
795345637|I personally think #Romney is dumb as fuck..|tweeter|disgust|Romney|not specified|True
795342321|Those who speak it, don't know it Those who know it, don't speak it. #Election2012 #Fact|tweeter|anger|politicians and voters|the election|True
795712227|Looks like I'm upsetting some libs already this morning. My work is done. They just can't handle the truth. #Mitt2012|tweeter|joy|liberals|dislike of Obama regime|True
794297959|I partied with #obama last night! Na na na na boo boo @heartofakilla|tweeter|joy|Obama|not specified|True
794101765|Don't forget to vote in the #AZ #primary #election today for #prochoice #Democrat #women! Your voice matters and your vote counts!|tweeter|joy|pro choice women|women's rights|True
795337260|Most people voting for Obama have no clue what they're voting for #RomneyRyan2012|tweeter|anger|Obama|the election|True
795348453|#Barack is THAT man..4 more years!|tweeter|joy|Obama|the election|True
795342320|She is SOOO stupid.. Bachmann Ads Blast Stimulus, Tout Stimulus Projects..#GOP #tcot #Obama2012 http//t.co/Wyh2C0cK|tweeter|anger|Michele bachman|Michele Bachman's agenda|True
795705459|#thingsihate people who don't take their right to vote seriously, and people who are uninformed #'merica #RomneyRyan2012|tweeter|anger|uninformed voters|Romney agenda|True
794101768|The other guy looks like he's up to no good. #Obama|tweeter|disgust|Romney|not specified|True
795669045|ROMNEY LIES AND AMERICANS LOSS THE MOST.MIDDLE CLASS WILL PAY HIGHER TAXES AND RICH PAYS NOTHING|tweeter|disgust|Romney|Romney's agenda|True
794208867|Cathy Mc Morris Rodgers sounds like a damn robot. #GOP2012 #Republicans #RepublicansAreDestroyingThisCountry|tweeter|anger|Republicans|republican agenda|True
794137721|Republican &amp Democrat might be what you see... All I see are dollar signs and greed. #Election2012|tweeter|disgust|voters|dislike of politicians|True
794097232|It's very funny how the republicans all ready know Obama has won but they still push Mitt loses by 10-25% in almost all gallop polls #Obama|tweeter|disgust|GOP|not specified|True
794297963|I can't even watch #GOP2012 anymore. It's making me nauseous.|tweeter|disgust|GOP|not specified|True
793899955|WE CAN DO BETTER!! And we will in November. #RNC2012 #MITT2012 @MittRomney|tweeter|joy|Mitt Romney|not specified|True
793892666|@WilV79 LOL. And you think there are NOT people that like entitlements and gov dependency who will vote for Obama no matter what?|tweeter|disgust|Obama supporters|anger at people who get government entitlements|True
794236735|If Mitt Romney gets elected, There is no hope for the USA. #obama|tweeter|fear|Romney|Romney's possible election|True
795657792| #wbzdebate is a trending topic in the US tonight! Not just Boston. #election2012 // Because Brown's a train-wreck in progress|tweeter|surprise|the American twitter public|debate|True
794208864|Barack Obama booked almost every seat for a Two Door Cinema Club gig, he's got good music taste.|tweeter|anger|Obama|not specified|True
794090979|Does anyone else see the news readers smile a douschey smile when they say president Obama?|tweeter|anger|reporters|not specified|True
794117003|@GaryContessa because Barack and his goons would rather focus on solar energy or keeping millions of people on welfare. #sad|tweeter|disgust|Obama|Obama agenda|True
795342322|You must really hate the black guy if you're defending Romney's idiocy at this point. #tcot #p2|tweeter|anger|Romney|the election|True
794101767|@koopah3d I fucks wit that video and that song son, It was major. Ending it wit Obama talkin was crucial|tweeter|joy|another tweeter|not specified|True
795345638|From the time he took office they were trying to get him out . Not fix the country.#Obama|tweeter|anger|Obama|dislike of Obama agenda|True
795637966|Why do we have Election Day if you can vote a month early? Why do we register if anyone can vote without proving who they are? #election2012|tweeter|disgust|Early voting|frustration with early voting processes|True
795345640|I hope Obama heard about this bitch Meghan.|tweeter|disgust|Obama|not specified|True
794174220| Mitt Romney can take his ass back to Massachusetts with that shit ! #OnMyMommaDoe|tweeter|disgust|Romney|not specified|True
794076567|if #romney wins the US election, i will crawl into a hole and cry for the next 4 years #obama|tweeter|disgust|Romney|dislike of mitt romney|True
795342323|If I had a nickel for every weave at TC Williams, I'd be asking you to call me Romney.|tweeter|anger|TC Williams|the election|True
795348452|Why would Niall Ferguson write blatant propaganda? Why would Harvard let him? He advised McCain in 2008. We know he hates Obama.|tweeter|disgust|Nial Ferguson|An article written by Niall Ferguson|True
793907379|Ah #Romney/Ryan fans / QT @AncientProverbs There's none so deaf as those who will not hear. -English Proverb|tweeter|disgust|Romney fans|not specified|True
795657788|@BarackObama Mr. President didn't you forget the already 22000 Dead in Syria while talking about the chemical WEAPONS? #Syria #Obama|tweeter|disgust|Obama|Conflict in Syria|True
794167145|#FoxNews just reported that even more taxpayers dollars are going to waste in Washington. Really? This is news? To who? #teaparty #gop|tweeter|disgust|RNC|taxpayer dollars going to waste|True
794167146|Love following Barack Obama but had to stop till after the elections. So tired of the vote now tweets! #needabreak|tweeter|anger|Obama|election overload|True
794090978|Snub? Not at beck &amp call? @haaretzonline Even if he got a point, #Obama wrong to snub #Netanyahu, writes @ChemiShalev http//t.co/c6Tz735C|tweeter|disgust|Obama|Obama's response to Israel|True
795337259|If Obama doesn't win again, I'm not standin up for the Pledge of Allegiance.|tweeter|anger|Obama|Barack Obama possibly not winning the election|True
794867003|But I also hate Mitt Romney. They both suck. This country is going to shit.|Tweeter|anger|Romney and Obama|not specified|True
794867001|@JenniferODay Hope ur having an amazing vacay! If u didnt get 2 watch DNC speeches u are in 4 treat! #Michelle #Bill #Barack #TheAvengers !|Tweeter|joy|Obama and team|Tweeter was impressed by DNC speeches|True
794867004|Just made a gagging noise instinctively when I saw #romney on TV. How did I move to TX &amp become more vocal about my liberalism|tweeter|disgust|Romney|no reason discussed but it's clear tweeter is disgusted my Romney|True
794894744|@homerosimpsone MITT ROMNEY TIED HIS DOG TO THE ROOF OF HIS CAR FOR A FAMILY VACATION AND DROVE LIKE THAT ALL DAY|Tweeter|disgust|Romney|tweeter alleges an incident where Romney was cruel to an animal|True
794811970|The tostitos commercial with the fake barack and romney had me rolling|Tweeter|joy|A Tositos television commercial|Rolling  laughing very hard. Therefor, the tweeter found the commercial very funny and entertaining.|True
794874660|smh at people thinking Romney is going to 'save' us from Obama, just like Obama was supposed to 'save' us from Bush #shellgame|Tweeter|anger|Romney and less to towards obama|not specified|True
795182775|LOL @ liberals acting like this FULL video of Obama talking n a accent, N calling Bush admin racist, ect does'nt matter! @seanhannity|tweeter|anger|liberals and obama|tweeter feels a video will have affect against Obama|True
794919986|@misscougar yeah AND Barack obama will be personally stealing all of them!!!!!!!!!!!!!|tweeter|anger|towards a fellow tweeter misscougar and Obama|not specified|True
794874659|Romney is Anti-Union, Do you know we all would work for minimum wage and be forced to buy insurance on the Obama Care Plan!|Tweeter|anger|Obama|Tweeter feels the Obama care plan|True
795174168|Ur rights here are limited because ur a minority!! What bullcrap is that?? #President|tweeter|anger|not specified well enough|not specified|True
795182777|If Obama doesn't win again, I'm not standin up for the Pledge of Allegiance.|tweeter|fear|possible election results|tweeter feels he cannot stand with America if their choice candidate does not win|True
794802928|My grandma (who's in her 80's) is going to vote for Obama. This will be the 1st democratic vote of her lifetime. #Obama #Grandmas4Obama #Yay|Tweeter|joy|Their Grandmother and Obama|The tweeters grandmother is voting for Obama the tweeter is happy about this|True
794874658|@GaryContessa because Barack and his goons would rather focus on solar energy or keeping millions of people on welfare. #sad|Tweeter|anger|Obama|not specified|True
794867002|@maddow now we need new #appliances and #romney sent manfctng jobs overseas #buyAmerican? Labor does matter so do the words MADE IN AMERICA|Tweeter|anger|Romney|Tweeter feels Romney has sent American jobs overseas specifically manufacturing jobs|True
795182774|@whitehouse #Obama to #Assad Kill as many as you want but don't mess up with the Chemicals #Syria|tweeter|anger|Obama|Tweeter seems to feel Obama does not care about the how many are killed|True
795116146|Clint will be the one laughing when Peter Jackson inserts Andy Serkis - playing a mocap Barack Obama - into that chair footage.|tweeter|joy|Clint Eastwood|Sounds like a spoof that has been made or will be made of the famous clint eastwood invisible obama skit|True
795138421|Fuck #Romney #teamobama|Tweeter|anger|Romney|not specified other than the tweeter is a proclaimed supporter of Romney's opposite|True
794881237|So sick of seeing #republicans on tv already.|Tweeter|anger|republicans|personal feelings expressed by tweeter|True
795130637|And he really tried to confront Obama about it why we loosing jobs, like if Obama aint do his research on that nigga already loll|tweeter|anger|Romney most likely or other Obama opposite most likely in some debate|Tweeter feels this unnamed opposite of Obama tried in a futile fashion to make Obama look unfavorable|True
794811968|@AmericanPapist how so? Romney was snickering as he left the stage after talking about dead Americans. #Romney #RomneyPoorPeopleFacts|Tweeter|disgust|Romney|The tweeter feels Romney was snickering after discussing dead Americans|True
795138423|Fuck the doomed. - #RomneyRyan2012|Tweeter|anger|not specified|not specified|True
795116147| #wbzdebate is a trending topic in the US tonight! Not just Boston. #election2012 // Because Brown's a train-wreck in progress|Tweeter|fear|Brown|something to do with what brown said or purposed or similar at the wbz debate|True
795130638|ObamaNation has turned into an abomination very very quickly. #RomneyRyan2012|tweeter|anger|Obama and Obama's supporters|the tweeter is a Romney supporter and doesn't like the reign of Obama|True
794881238|You know what? I AM better off today than four years ago. #4moreyears!|Tweeter|joy|Obama|Obama had been in office for four years and was up again|True
794802932|@BarackObama God bless you, Mr. Obama! Peace for the world! Amen!|Tweeter|joy|Obama|Tweeter feels Obama will promote world peace|True
795882312|hmm, #democrats seem to skew the truth to their favor while #republicans just straight up lie. In the end... they're all fucking liars.|tweeter|anger|#democrats #republicans|#democrats seem to skew the truth to their favor while #republicans just straight up lie|True
795678079|Here comes Bubba! #DNC2012 #BillClinton #ObamaBiden2012 #p2|tweeter|joy|#DNC2012 #BillClinton #ObamaBiden2012|#DNC2012 #BillClinton #ObamaBiden2012 #p2|True
795888441|the obama rally can't start on time, just like how he can't keep our country on track #mitt2012|tweeter|disgust|obama|not specified|True
795873151|Waiting for #GOP to announce plan to just do away with voting and hand over seats based on income higher income, higher gov't office.|tweeter|disgust|#GOP|not specified|True
795904255|A 'War on Coal'? Seriously, #Romney? The miners were forced by mgmt to attend the filming of your #desperate #propaganda piece! #fraud #GOP|tweeter|disgust|#Romney|A 'War on Coal'? Seriously, #Romney? The miners were forced by mgmt to attend|True
795893840|Fourth straight trillion dollar deficit under B.O. Fiscal insanity, immoral, and feckless leadership. Wake up, patriots #OIW #RomneyRyan2012|tweeter|anger|patriots|Fourth straight trillion dollar deficit under B.O. Fiscal insanity, immoral, and feckless leadership.|True
795678081|#Republicans are a joke. Clint Eastwood is their mascot! America is in trouble if these idiots win! #RNC|tweeter|disgust|#Republicans|Clint Eastwood is their mascot!|True
795689233|What do you mean the bus isn't going that way today?! Oh yeah Obama is coming #president #iowastate|tweeter|joy|Obama, #president|not specified|True
795911360|Please don't get me wrong, I hate all politicians. The media coverage of the strip clubs in Tampa just leaves the #GOP wide open.|tweeter|anger|#GOP|The media coverage of the strip clubs in Tampa just leaves the #GOP wide open.|True
795873148|I'll take the Mormon over the moron. #RomneyRyan2012 #ForALL|tweeter|disgust|the moron|#RomneyRyan2012 #ForALL|True
795882316|The hours hookers put in at these US conventions are long and tiring but neither Romney or Obama thanked them. SAD! #gop2012 #dnc|tweeter|sadness|#gop2012 #dnc|The hours hookers put in at these US conventions are long and tiring but neither Romney or Obama thanked them.|True
795836302|#FOCUS  No one in history has ever successfully run for #President riding this #Big of a #Lie! #MittRomney http//t.co/sXz068A7 #p2|tweeter|anger|#MittRomney|not specified|True
795847256|Until I have Mitt Romney birth certificate in hand I refuse to believe that he wasn born in the fourth circle of Hell. #stolentweet|tweeter|anger|Mitt Romney|not specified|True
795836300|Good Morning! Love me some #MorningJoe w/ a side of Brokaw #MSNBC #election2012|tweeter|joy|#MSNBC|not specified|True
795865996|Romney/Ryan continuous and consistent lying has become the GOP tactic of choice. Fact checkers classified as liberal and pro-Obama. #GOPFAIL|tweeter|disgust|Romney/Ryan|continuous and consistent lying|True
795695766|If it don't rain,tax for gas. Partly cloudy ,tax for gas. Obama tweeted, tax for gas. Mexican win the lottery,tax for gas. Any reason SMh|tweeter|anger|Obama|tax for gas.|True
795678082|Even though everyone gets them, seeing Paul Ryan show up in my inbox always excites me. Love that man. #RomneyRyan2012|tweeter|joy|Paul Ryan|seeing Paul Ryan show up in my inbox|True
795904258|Can someone just rape nicki minaj, get her pregnant, and see if she'll still vote Romney.|tweeter|anger|nicki minaj|not specified|True
795888438|ObamaNation has turned into an abomination very very quickly. #RomneyRyan2012|tweeter|disgust|ObamaNation|not specified|True
