id|text|experiencer|emotion|target|cause|selected
776111321|Everyone in southern MN @TimWalz is nothing more than an Obama/Pelosi/Reid radical leftist liberal. Wake up people!!!|Tweeter|anger|Everyone in southern MN|TimWalz is nothing more than an Obama/Pelosi/Reid radical leftist liberal.|True
774266143|This world is so wrong! If I was #president things would be a lot different #annoyed|president|anger|world|This world is so wrong!|True
775423225|Maybe after the debate tonight, America will realize #WeCantAfford4More #RomneyRyan2012|Tweeter|anger|America|debate tonight,|True
775531765|When #Romney says #Obama got every piece of legislation passed that he wanted, Romney sounds dumb. Right #CNN #MSNBC #FOX|Tweeter|anger|Romney|Romney sounds dumb|True
774421368|Nothing in life is free you have to work hard. Unless you are a Democrat- Coach Triveri #Republicans|Tweeter|anger|Democrat|Nothing in life is free you have to work hard. Unless you are a Democrat|True
775238218|I support helping the needy, I oppose funding the lazy. #RomneyRyan2012|Tweeter|anger|lazy|I oppose funding the lazy|True
774009317|@chuckdteach I agree very negative campaigning #fact #Campaign2012|Tweeter|anger|@chuckdteach|I agree very negative campaigning|True
776015592|@Obama2012 @BarackObama And I see that my tax dollars are going to help people who should be helping themselves. #ROMNEY|Tweeter|anger|BarackObama|see that my tax dollars are going to help people who should be helping themselves|True
775531764|Cant wait to hear Obama's official acceptance speech tonight. Can it beat Clinton's &amp Michelle Obama's amazing speeches?! #DNC #4moreyears|Tweeter|joy|Obama's official acceptance speech|Cant wait to hear Obama's official acceptance speech|True
775384527|Paul Ryan is a fraud. #romney #obama #election http\/\/t.co\/dyQpzhi9|Tweeter|anger|Paul Ryan|Paul Ryan is a fraud|True
774338165|Mitt Romney's such a fucking douche.|Tweeter|anger|Mitt Romney|Mitt Romney's such a fucking douche.|True
776015590|#IWannaKnowWhy people are assholes and are so uptight in the months leading to the #Election during an election year.|Tweeter|anger|people|people are assholes and are so uptight in the months leading to the #Election|True
775531761|Unfortunately I didn't hear enough from #DNC (or #RNC for that matter) regarding help for #SmallBusiness WE NEED HELP #OBAMA or #ROMNEY!|Tweeter|anger|OBAMA ROMNEY|I didn't hear enough from #DNC (or #RNC for that matter) regarding help for #SmallBusiness|True
775423227|#WomenForObama gathering with #JillBiden in Mpls! So excited. #4MoreYears|Tweeter|joy|WomenForObama|WomenForObama gathering with #JillBiden|True
774086043|We are not going back we are moving forward #Obama|Tweeter|joy|Obama|We are not going back we are moving forward|True
775747385|@kojoshow why are defense cuts anathema to the #gop? They're in favor of running gov't like biz... all other agencies asked 2 do more w/less|Tweeter|anger|defense cuts|why are defense cuts anathema to the #gop|True
775710002|Thank #Congress for screwing #Obama! As long as we get our country back #Republican it is! #Democrats must b on the #Republican payroll.|Tweeter|anger|Democrats|Democrats must b on the #Republican payroll|True
774098120|Barack Obama singing things on youtube is the greatest|Tweeter|joy|Barack Obama|Barack Obama singing things on youtube|True
775784931|LOL at the Rolling Stone piece on Mitt Romney...|Tweeter|joy|Rolling Stone piece on Mitt Romney|the Rolling Stone piece on Mitt Romney.|True
775502520|BaRack em rack Obama , smfh . Kids watch the bullshit|Tweeter|anger|Obama|Kids watch the bullshit|True
775384529|So when politicians lie they get elected (#Clegg) and when they tell the truth they're destroyed by media who label them losers (#Romney)|Tweeter|anger|politicians|So when politicians lie they get elected|True
775384538|@2ndTREASURE the new Obama on SNL suuuuucks! Bring back Fred Armisen!|Tweeter|anger|SNL|new Obama on SNL suuuuucks|True
775591451|Watching the replay of The Haters. Oh, I mean @FNTheFive . I think they hate themselves more than they hate #Obama @FoxNews #Romney|Tweeter|anger|FNTheFive|Watching the replay of The Haters.|True
773962531|I do not want Obama for another 4 years, because he's gonna ruin this country &amp we're gonna be in so much debt #RomneyRyan2012|Tweeter|fear|Obama #RomneyRyan2012|he's gonna ruin this country & we're gonna be in so much debt|True
774072358|Today's crowd of 18,000 at the speech at Milwaukee's lakefront festival grounds was the largest of #Obama's re-election campaign. #momentum|Tweeter|joy|#Obama's re-election campaign.|Today's crowd of 18,000 at the speech at Milwaukee's lakefront festival grounds was the largest of|True
775747383|@ClaytonMorris if that's what they're worried about, then I have a recommendation for a part of the gov that #Romney #Ryan should reduce.|Tweeter|anger|ClaytonMorris|if that's what they're worried about|True
774032317|#espn #urbanmeyer and #Obama all have a slobbering love affair together with this skewed media...is anyone else getting tired of this?|Tweeter|anger|#espn #urbanmeyer and #Obama|all have a slobbering love affair together with this skewed media.|True
774338164|finally catching up all the speeches from the DNC this week #4moreyears|Tweeter|joy|speeches from the DNC|speeches from the DNC|True
775205155|Was reading up on some politics, I'm not feeling #Obama health reform. Is that even true? You MUST have health insurance?|Tweeter|anger|other Tweeter|Was reading up on some politics, I'm not feeling #Obama health reform.|True
776015593|Listening to a head office guy spew shit about mitt romney... Fuck you and your views dude. I dont support hatred in any way dickhead|Tweeter|anger|mitt romney|I dont support hatred in any way dickhead|True
776073936|Just cause biden said BS, yall suppose to think that the president is some cursing machine and alcoholic! Come on VB #Fox25 #republicans|Tweeter|anger|biden|Just cause biden said BS, yall suppose to think that the president is some cursing machine and alcoholic|True
775747386|WHO IS THE ASSHOLE THAT DECIDE TO PUT SUPPORT OBAMA ADS ON MY PANDORA? Communist. #RomneyRyan2012|Tweeter|anger|OBAMA ADS|DECIDE TO PUT SUPPORT OBAMA ADS ON MY PANDORA?|True
775591454|#Romney is running for #president, thinking that half of the country is a troop of slackers and opportunists. #God save the world from him|Tweeter|anger|Romney|Romney is running for #president, thinking that half of the country is a troop of slackers and opportunists.|True
774072355|When Mitt Romney thinks what you said is offensive and wrong, YOU'RE WRONG. (Looking at you, Todd Akin.)|Tweeter|anger|Mitt Romney|Mitt Romney thinks what you said is offensive and wrong, YOU'RE WRONG|True
775205153|@Drastik07 Go see #2016ObamasAmerica then go vote #RomneyRyan2012 or I hope you enjoy everything taken away from you #ObamaIsACommie|Tweeter|anger|Obama|ObamaIsACommie|True
774421365|Michelle Obama could be the main reason Barack gets re-elected. Very impressive speech.#4moreyears|Tweeter|joy|Michelle Obama|Very impressive speech.|True
775502521|NO REALITY TV.....Turn on CNN to see real tv! #BARACK!!!|Tweeter|anger|CNN|NO REALITY TV.|True
775531762|Who particularly gives a fuck who #Americas next #president is ?? More pressing issues at home to be dealt with then the coverage this gets.|Tweeter|anger|Americas next #president|More pressing issues at home to be dealt with then the coverage this gets.|True
774086044|Glad Obama had Bin Laden killed #NeverForget911 #4moreYears|Tweeter|joy|Obama|Obama had Bin Laden killed|True
774009316|New US #election idea quieter TV commercials. Sure vote-getter! #screamingduringfootball|Tweeter|disgust|TV commercials|New US #election idea quieter TV commercials.|True
774032316|Correction @SagPhoenix @kybelle1957 @cspanwj The only problem #GOP supporters have is #Romney fearing being greedy &amp proud of it!|Tweeter|anger|Romney|!Romney fearing being greedy & proud of it!|True
775710003|#RomneyRyan2012 can lick my mofuckin' clit. fuck you bitches|Tweeter|anger|RomneyRyan2012|RomneyRyan2012 can lick my mofuckin' clit|True
775423226|Laying in bed watching obama talk yelling at the T.V. I don't agree with anything he says. #nobama|Tweeter|anger|obama|watching obama talk|True
775502517|Jimmy fallon rocks #barack Obama tribute to Taylor tune # just the best # vote Obama 4 more yrs|Tweeter|joy|Jimmy fallon|barack Obama tribute to Taylor tune|True
775710004|Im tired of politics, I hope they go into hiding until November #election|Tweeter|anger|politics|Im tired of politics,|True
774072357|Romney for president &lt&lt&lt&lt&lt&lt&lt&lt&lt I DON'T FUCKING THINK SO BITCHHHHHHHH|Tweeter|anger|Romney|Romney for president|True
776111319|@megynkelly WHY is Mitt Romney being Mormon an but Harry Reid, Obama right hand man, being Mormon a non-issue?|Tweeter|anger|megynkelly|Obama right hand man, being Mormon a non-issue?|True
775747384|Dude, fuck Romney! Literally interrupting every YouTube video. Lost my vote, I mean I was never going to vote for you anyway. Bitch.|Tweeter|anger|Romney|interrupting every YouTube video.|True
774338161|the Romney administration has to be the poorest most inconsistent presidential campaign in the last century. #republicans #sad|Tweeter|anger|Romney|inconsistent presidential campaign|True
774098118|This week, people all over the world will die fighting for a voice, while #republicans in the U.S. fight to take yours away. #FightVoterID|Tweeter|anger|republicans|FightVoterID|True
775384535|Ryan keeps talking about keeping our country free, but keeps forgetting the shackles he has in his BMW for women. #GOP|Tweeter|anger|Ryan|Ryan keeps talking about keeping our country free|True
774072356|Why does the #GOP in office care about my #vagina for? Damn, #Republicans. #TransvaginalUltrasounds|Tweeter|anger|Republicans|the #GOP in office care about my #vagina|True
775710000|I hear alot of chatter of Obama's stats. Break down Romney stats and please talk something new besides The olympics.|Tweeter|anger|Romney stats|I hear alot of chatter of Obama's stats.|True
775634406|there's a Romney booth on campus I'm thinking about bum rushing the shit out of it and trashing the place|Tweeter|anger|Romney booth|Romney booth on campus|True
776047184|Why did the music director not cue up a little Carl Orff for Luis Fortu #GOP2012|Tweeter|anger|music director|music director not cue up a little Carl Orff for Luis Fortu|True
776015591|#Obama got a 5 point bounce from the #DNC Convention. Not even the #KochBrother's billions can eradicate him from the scene!! #OFA #Romney|Tweeter|anger|Obama|Obama got a 5 point bounce from the #DNC Convention|True
775238216|oh yea. obama u still suck.|Tweeter|anger|Tweeter|obama u still suck.|True
775238217|I'm pumped to see mitt romney today!! #election2012|Tweeter|joy|mitt romney|I'm pumped to see mitt romney|True
774338163|How is it that Republicans can't find a better candidate than #Romney? Even if I were Republican (I'm not) I wouldn't DARE vote for him.|Tweeter|anger|Romney|Republicans can't find a better candidate than #Romney?|True
775710001|Great day. Took my son fishing and to the gun range. #freedom. #GOP2012|Tweeter|joy|GOP|Took my son fishing and to the gun range|True
774266144|If mitt Romney becomes president ..... I will get a tattoo of a butterfly on my stomach !!!|Tweeter|joy|mitt Romney|tattoo of a butterfly on my stomach|True
775205148|OK camera man we get it you dig busty moms and their babies. Enough with the close ups already! #dnc2012 #ObamaBiden2012 #DEMS|Tweeter|anger|camera man|Enough with the close ups already|True
775567441|today i was watching CNN and our debt has grown since 2010 by about 30 percent...we need a new president #romney|Tweeter|anger|romney|debt has grown since 2010 by about 30 percent|True
774421366|Obama wanted change I threw a couple fuckin pennies at him.|Tweeter|anger|Obama|Obama wanted change|True
775855426|Dinesh D'Souza is a fucking idiot. #Obama|Tweeter|disgust|D'Souza|not specified|True
776952975|#Obama should bomb #Iran, NOW! Iran must NOT have nukes! It executes child rape victims 4 'adultery'! It is NUTS!!!|Tweeter|disgust|Iran|not specified|True
775881859|This world is hell whether Obama is re-elected or Romney wins. #election2012|Tweeter|sadness|election|not specified|True
774131017|OK camera man we get it you dig busty moms and their babies. Enough with the close ups already! #dnc2012 #ObamaBiden2012 #DEMS|tweeter|anger|camera man|not specified|True
772781351|Just another #Catholic supporting the Church's positive teaching on wealth redistribution and #Obama 1998 comments!|tweeter|anger|another #Catholic|not specified|True
776943784|Pols are too busy asking me for money to answer my questions. They appear to want my cash but not my vote so they'll get neither. #Romney|Tweeter|disgust|Pols|busy asking me for money|True
772847047|Mitt Romney AND Barack Obama full of shit. I don't know why everybody insist on taking sides &lt|tweeter|disgust|Mitt RomneyBarack Obama|not specified|True
775872516|@JedediahBila Yes. It was a funny start to an awesome rally in Powell, OH today. #RomneyRyan2012|Tweeter|joy|Romney|not specified|True
775846927|It never ceases to depress me that some people can not condemn the deaths of innocent ppl without a follow-up caveat #morsi #karzai #Romney|Tweeter|sadness|some people|not specified|True
772521772|people are so ignorant. You want Obama out of office so badly but yet do you even know the policies he has? Do you even know Romney's?|tweeter|anger|people|not specified|True
772789028|#RomneyRyan2012 rally in Commerce Twp, MI today... Was literally this close!! #awesome #BelieveInAmerica http//t.co/GnceIuLS|tweeter|joy|Romney|not specified|True
775846930|oh yea. obama u still suck.|Tweeter|disgust|Tweeter|not specified|True
774131018|Cowboys vs. Giants &gt DNC convention - great planning #DNC2012 #Campaign2012|Tweeter|anger|DNC|not specified|True
774140058|Right Now GOP Is Trying To Ban Abortion. Regardless The Circumstance. #Wow #Election2012|tweeter|disgust|GOP|Ban Abortion. Regardless The Circumstance|True
776937793|So 1st #Republicans hate the @MittRomney statement, but at the end of the week they are loving it? #Shady #Libya|Tweeter|anger|Republicans|not specified|True
772794119|@MittRomney Welcome back to Westerville and the Buckeye state. Looking forward to a great rally! #RomneyRyan2012|tweeter|joy|Romney|not specified|True
772492830|What I learned from SuperPac ads Mitt Romney likes to hunt sick Steelworkers' wives for sport from atop his dressage horse, Refalka.|tweeter|anger|super pac ads|not specified|True
775726269|The #GOP is getting more bizarre and perverse by the minute. They're making the scientologists look sane by comparison.|tweeter|disgust|GOP|not specified|True
772794115|Some dum guy frm american Threaten to kill barack now his in Pen dahs a good lesson for all u kids dah fink unoe everythin.......#ReaLife|tweeter|disgust|Some dum guy|not specified|True
772541167|Oh but Ivory, Obama blames Islam for 9/11 too?|tweeter|anger|Obama|not specified|True
772622497|Please stop talking about Todd Akin's rape fantasies and refocus on me. I legitimately assault a whole government! #truth #RomneyRyan2012|tweeter|anger|Romney|not specified|True
776937794|When I see @CIROCOBAMA im gonna punch him in his mutha fuckin face #GOLDDICK style!|Tweeter|anger|OBAMA|not specified|True
772622499|That awkward moment you realize Mitt Romney Slogan, America American was the same slogan used by the KKK in 1922|tweeter|disgust|Romney|not specified|True
772830224|#Obama plays games on disclosing taxes? #Romney should ask him to disclose school records @MittRomney @TeamRomney @RepublicanGOP|twitter|anger|Obama|Obama plays games|True
774151261|Obama's first term is a complete failure. Anyone who votes for proven failure is uniformed, brain-dead or a loser.|tweeter|disgust|Obama|not specified|True
772592479|@MorningJoe how is #Romney talk about operating govt like private biz. Profits are fabulous, unemployment is high. How is that comforting?|tweeter|fear|Romney|not specified|True
772648158|Who particularly gives a fuck who #Americas next #president is ?? More pressing issues at home to be dealt with then the coverage this gets.|tweeter|anger|next #president|not specified|True
772492834|THE BEST ten days in USVI with krys. Long day of traveling tomorrow! #GOPCOVENTIONWHENIGETHOME #withmitt #RomneyRyan2012|tweeter|joy|gop|not specified|True
772598956|We're really excited because this week is Proud to Be a Democrat Week on campus! We have a lot of exciting events planned! #gobama #dems2012|tweeter|joy|Democrat|not specified|True
775737961|@IrenieM @dorisatkinson @alanp305 @RCdeWinter @elegantdame @hartcap Yes true! Total fool about women! #Elitism #Romney|tweeter|disgust|Romney|not specified|True
772486523|Not in our entire history has one of our ambassadors been murdered/anally raped untill.9/11/12 Obama partied w/jay-z,Kenya/kim, Hamas and|Tweeter|disgust|obama|not specified|True
772479367|Hmm @NJGovChristie bad mouths @JerryBrownGov yet Meg Whitman has record losses/layoffs @HP. She can't run a company let alone my state #GOP|twitter|anger|Christie|not specified|True
776926292|7 A.M. and I haven't fallen asleep yet. Also, Twitter, stop trending Romney. I'm gonna try falling asleep again. Buh bye.|Tweeter|fear|Romney|not specified|True
772580568|@NateLOlsen 1 term president! #obama|tweeter|disgust|obama|not specified|True
772576269|@blakehounshell @TonyKaron yeah, and why a shit existing since 2010 is buzzed as if released 2012 9/11?? hate #election years ..|tweeter|anger|not specified|not specified|True
775745713|There is just no end to the Damage @BarackObama has done to #America. It's time to kick him out of the White House. #tcot #gop #teaparty|tweeter|disgust|Obama|no end to the Damage|True
772472325|#obama How freaking exciting is this?? Make the cap fit the head.|tweeter|anger|not specified|not specified|True
772781349|#Romney please shut the fuck up.|tweeter|disgust|Romney|not specified|True
772570491|Vote Romney. Because he hates 47% of you, and because everyone should write off their dancing horse as a tax write off of up to $77,000|tweeter|disgust|Romney|not specified|True
772776955|This week, people all over the world will die fighting for a voice, while #republicans in the U.S. fight to take yours away. #FightVoterID|tweeter|anger|republicans|not specified|True
772526579|Man these #republicans trying to run game|tweeter|anger|republicans|not specified|True
772479368|Cant wait to hear Obama's official acceptance speech tonight. Can it beat Clinton's &amp Michelle Obama's amazing speeches?! #DNC #4moreyears|tweeter|joy|clinton & michelle obama|not specified|True
776926297|Sorry. It's not just hypocrisy - it's flat out lies. Check your facts, #GOP. You can't fool us anymore!!!! #Obama2012 http//t.co/C4HU8bIF|Tweeter|disgust|GOP|not specified|True
774124386|@JedediahBila @SenRandPaul Go Rand Paul bragging on Romney..yeah that right..he's MY senator!! whoohoooo|tweeter|joy|Rand Paul|bragging on Romney|True
772653507|Does anyone find it ironic Barack #VoteOneDirection over justin even though justin lives in the US? No? Just me? ok. #VOTEONEDIRECTION|tweeter|surprise|Barack|not specified|True
775759933|another dumbass in the long list of GOPs Todd Akin. a sure bet among women. LMAO!! #GOP #US #MittRomney|tweeter|disgust|GOP|not specified|True
772570490|twitter at 218AM PST blah blah blah #RNC2012 blah blah #Romney blah #Eastwood blah blah #chair blah #Obama blah blah blah #invisible ?|tweeter|anger|RomneyObama|not specified|True
772776947|Home Values down 30% National debt 15 trillion Gas prices up over 100% Unemployment over 8 % 16 million more on food stamps Vote Obama??|tweeter|disgust|Obama|Home Values down 30% National debt 15 trillion Gas prices up over 100% Unemployment over 8 % 16 million more on food stamps|True
776932232|The Fed should be ended period.They have single handedly screwed up any chance of US recovery.$ is worth nothing.Prices rise as result. #gop|Tweeter|disgust|The Fed|not specified|True
775726266|who ever it is ....we will still have a idiot who runs our country #election #endoftheworld|tweeter|disgust|not specified|not specified|True
772776953|It's because of people like #ToddAkins that I refuse to ever vote for the #GOP. No matter how much I hate the dumbocrats.|tweeter|anger|GOP|because of people like #ToddAkins|True
774157030|I think @MittRomney is right, #47percent of people were never gunna vote for him even before that video came out. Nice pick, #GOP2012|tweeter|disgust|Romney|not specified|True
774124389|@Minarzouki don't get me started on Romney. He genuinely scares me.|tweeter|fear|Romney|not specified|True
775863590|I hate itwhen the media says Romney donated so much charity, he donated it to his church. #election2012|Tweeter|disgust|Romney|not specified|True
775752797|So happy I got to see the president!!!! #obama|tweeter|joy|obama|not specified|True
772847045|When Mitt Romney thinks what you said is offensive and wrong, YOU'RE WRONG. (Looking at you, Todd Akin.)|tweeter|disgust|Akin|not specified|True
772486522|Was Clint Eastwood drunk??? #RNC #RNC2012 #GOP|tweeter|anger|clint eastwood|not specified|True
772847046|WHO IS THE ASSHOLE THAT DECIDE TO PUT SUPPORT OBAMA ADS ON MY PANDORA? Communist. #RomneyRyan2012|tweeter|disgust|OBAMA|SUPPORT OBAMA ADS ON MY PANDORA|True
775737962|Romney church (he was bishop) believed black ppl where decedents of satan until the 1970s hmmm...let me register 2 vote against him|tweeter|disgust|Romney|believed black ppl where decedents of satan|True
772472323|Actually learn and understand Romney and Obama's economic plans then come tell me who you support. #4moreyears #please|tweeter|anger|not specified|not specified|True
772830228|#Republicans #Democrats  #Liars They don't know what it's like to struggle from #paycheck to #paycheck #NoRespect|tweeter|disgust|RepublicansDemocrats|not specified|True
774053271|@TheFPShow Obama so I can bust a cap on him|tweeter|anger|Obama|not specified|True
772841481|Ryan keeps talking about keeping our country free, but keeps forgetting the shackles he has in his BMW for women. #GOP|tweeter|disgust|Ryan|not specified|True
772547529|#WomenForObama gathering with #JillBiden in Mpls! So excited. #4MoreYears|tweeter|joy|Obama|not specified|True
774157026|So disgusted with both political parties. Both Obama and Mitt make me sick.|tweeter|disgust|both political parties|Obama and Mitt make me sick|True
772616377|Class cancelled Thursday because Obama hehe love it|tweeter|surprise|Obama|not specified|True
772776956|@henryburchett blacks, Hispanics, non-Christians, gays, take your pick. The poor and other minorities will have it worse under Romney.|tweeter|fear|Romney|not specified|True
772799300|The bigotry of republicans is only matched by the ignorance of democrats #Election2012|tweeter|disgust|republicansdemocrats|not specified|True
774151262|@ChrisMooney @thinkprogress I'm surprised he didn't accuse Obama of having a weather machine.|tweeter|disgust|he|not specified|True
775737964|I hate #election years. Keep your ads off #youtube!|tweeter|anger|election years|not specified|True
775846928|I can't stand hearing @BarackObama lecture me about how unfair this country is. Good thing he's only got a few months left! #RomneyRyan2012|Tweeter|disgust|Obama|not specified.|True
772592480|@TwitchyTeam - that's fair the rest of us aren't satisified with Obama's manipulated certificate of live birth.|tweeter|anger|Obama|not specified|True
776952977|#espn #urbanmeyer and #Obama all have a slobbering love affair together with this skewed media...is anyone else getting tired of this?|Tweeter|disgust|skewed media|not specified|True
772622496|The new laws Romney &amp Ryan want to.implement &lt Unt uh ! They CANNOT win .|tweeter|fear|Romney & Ryan|not specified|True
772841479|@barackobama @obama2012 When in doubt, Bombard a Muslim Country.. #Quote #Obama|tweeter|disgust|obama|not specified|True
775881863|#Election2012 My next biggest question Do Republicans still own ALL the voting machines? REALLY?!? #ConflictOfInterest #Stealing #Idiots|Tweeter|disgust|Republicans|not specified|True
772799298|The Anti Christ is about to speak...all hail Americas Supreme Leader Ayatollah #Barack Obama!! #DNC And yes, GOD Bless America!!! #1TermOnly|tweeter|anger|Obama|not specified|True
772486519|Saw a headline on my phone that Obama is leaning toward Ryan's education plan...Say WHAT? WHAT? Me thinks I just saw a pig flyin'|tweeter|anger|headline|not specified|True
772855172|Thank #Congress for screwing #Obama! As long as we get our country back #Republican it is! #Democrats must b on the #Republican payroll.|tweeter|disgust|Congress|not specified|True
776932229|@Russell Simmons thinks that, #Barack is the first Black American to have a Dream.|Tweeter|anger|Simmons|not specified|True
774151260|Can't wait til the election is over so I don't have to see another political commercial for another four years. #election|tweeter|disgust|election|don't have to see another political commercial|True
772799299|@Norsu2 @IngrahamAngle Yes, Laura, you need more information about the man. Please do us all the favor. #tcot #mitt2012 #romney|tweeter|anger|Laura|not specified|True
772534184|I get to do the #GOP2012 roll call vote for Nebraska. A true honor. #NEGOP.|tweeter|joy|GOP2012|not specified|True
772547528|Saw President #41 and #43 today at @rydercup, even saw Rev Jesse Jackson, guess #democrats don't support the biggest golf event in the land!|tweeter|disgust|democrats|not specified|True
772781350|Did Nicki Minaj really endorse Mitt Romney?!|tweeter|surprise|Nicki Minaj|not specified|True
774131019|Mitt Romney has been caught in so many lies publicly its ridiculous...and Paul Ryan is just an imbecile.. #MyOpinion|tweeter|disgust|Romney|not specified|True
