id|text|experiencer|emotion|target|cause|selected
774175915|@davidjeremiah Barack Obama is a demon bent on destruction but Romney is too. Mormonism is the apostasy church that recreates Christ.|tweeter|anger|Barack Obama Romney Mormonism|not specified|True
774440259|there's a Romney booth on campus I'm thinking about bum rushing the shit out of it and trashing the place|tweeter|anger|Romney booth|not specified|True
766558284|If you vote for Mitt Romney, you are an idiot and you hate America|tweeter|anger|If you vote for Mitt Romney|not specified|True
775770814|The #GOP is getting more bizarre and perverse by the minute. They're making the scientologists look sane by comparison.|tweeter|disgust|#GOP|not specified|True
773237279|#Romney is running for #president, thinking that half of the country is a troop of slackers and opportunists. #God save the world from him|tweeter|fear|#Romney|not specified|True
770592760|America...Look no further. I am the hope you have been in search of. Murphy 2012 #election #tiredoftvads|tweeter|anger|tvads|not specified|True
775759674|My only regret about two hurricanes washing away the #RNC is that not all of the #Republicans will be there.|tweeter|anger|#Republicans|not specified|True
774298057|Barack Obama has more respect for illegal aliens and terrorists than he does for American entrepreneurs. (taken from a tweet by JayDavis)|JayDavis|disgust|Barack Obama|not specified|True
774298058|#Romney is the punishment of the universe|tweeter|disgust|#Romney|not specified|True
774121619|You know it's bad when even FOX NEWS call's bullshit on your speech.... #Ryanspeech #mitt2012|tweeter|disgust|#Ryanspeech #mitt2012|not specified|True
774550252|I hate #election years. Keep your ads off #youtube!|tweeter|anger|#election years|Keep your ads off #youtube|True
774175914|'studens just think everyones gonna pay for their schooling!' I hate #republicans. Get out of my workplace.|tweeter|anger|#republicans|'studens just think everyones gonna pay for their schooling!'|True
766550750|#FREEFRED OR MITT ROMNEY GOING TO BE PRESIDENT|tweeter|fear|MITT ROMNEY|not specified|True
774317685|I had the worst dream ever last night...I was in a voting booth and I picked mitt romney!!! Aaahhhhh. #mittromney #republicans|tweeter|fear|mitt romney|not specified|True
770592762|I fuck with Boosie Boo..I cant vote for Romney tho..these chicks need this assistance let them live.|tweeter|sadness|Boosie Boo|cant vote for Romney tho|True
768109059|Maggie Brooks and Louise Slaughter need to get off my television. Please and thank you. #election2012 #mudslinging|tweeter|disgust|Maggie Brooks and Louise Slaughter|#mudslinging|True
774158312|It is important to show Christ's love for all people not just #Republicans or #Democrats ... Love just the same ... &gt3|tweeter|joy|all people|not specified|True
775770810|When Mitt Romney thinks what you said is offensive and wrong, YOU'RE WRONG. (Looking at you, Todd Akin.)|tweeter|disgust|Todd Akin|what you said|True
768268360|I might vote for Romney if paul Ryan's dumbass wasn't on the ticket w him|tweeter|disgust|paul Ryan|not specified|True
774158311|@CRocObama not even with stretch arm strong arms ?|tweeter|disgust|Obama|not specified|True
773465815|Regardless of facts presented that paints a clear picture of the truth, people will believe what they want to believe. #election|tweeter|sadness|people|not specified|True
773103193|@AgentOrchid OK - but Clint Eastwood miming slitting someone's (Obama's?) throat was more than sad, and met with no opposition from #GOP.|tweeter|disgust|#GOP.|miming slitting someone's (Obama's?) throat|True
770592764|So I had a dream that Obama came to visit my husband in our beautiful house. That was such a good visual of what life could be. |tweeter|joy|a dream|not specified|True
768096297|What if Romney becomes president. I'd probably run for it. #election|tweeter|fear|Romney|if Romney becomes president.|True
773227473|I hate itwhen the media says Romney donated so much charity, he donated it to his church. #election2012|tweeter|anger|the media|says Romney donated so much charity|True
770076282|Because of #marriageequality, my same-sex friends have a #realmarriage too, @AnnDRomney #GOP 2012 @hrc|tweeter|joy|#marriageequality|not specified|True
774326826|@AndreaTantaros hey coward - u got the guts to bring up the issue of the day, i.e. romney going birther?|tweeter|anger|@AndreaTantaros|not specified|True
770083068|So disgusted with both political parties. Both Obama and Mitt make me sick.|tweeter|disgust|Obama and Mitt|not specified|True
775028084|You think it's really a coincidence that Mitt Romney is ratcheting up the subtle racist rhetoric? Heck no. By no means.|tweeter|disgust|Mitt Romney|not specified|True
770185777|President #Obama, the middle east is in flames. IT'S 3AM AND THE PHONE IS RINGING!!! #tcot|tweeter|anger|President #Obama|not specified|True
775028083|#RomneyRyan2012 Democrats are aliens from some ware unbenost to the cominsence thinking person.Did he say he was going to tell the truth|tweeter|disgust|#RomneyRyan2012|not specified|True
773265338|What #romney meant by 47% was half the country rather cuddle a porcupine then vote for him.|tweeter|disgust|#romney|not specified|True
773465813|#DNC2012 got me live. One word. Genius. That speech was pure perfection! #Obama 2012 #4MoreYears !|tweeter|joy|Obama|not specified|True
774432443|Onceyou go black you never go back america lol #Obama #2012 #4moreyears #Forward|tweeter|joy|#Obama|not specified|True
774403106|RT @mrleroi #Republicans have become the American #Taliban. They're afraid of vaginas unless they control them because they can't control themselves.|tweeter|disgust|#Republicans|not specified|True
774432446|@Drastik07 Go see #2016ObamasAmerica then go vote #RomneyRyan2012 or I hope you enjoy everything taken away from you #ObamaIsACommie|tweeter|disgust|Obama|not specified|True
774595175|The new laws Romney &amp Ryan want to.implement &lt Unt uh ! They CANNOT win .|tweeter|fear|Romney & Ryan|The new laws Romney & Ryan want to.implement|True
774078643|@Obama2012 @BarackObama And I see that my tax dollars are going to help people who should be helping themselves. #ROMNEY|tweeter|anger|@Obama2012 @BarackObama|not specified|True
773214210|who ever it is ....we will still have a idiot who runs our country #election #endoftheworld|tweeter|fear|who ever it is|not specified|True
774129682|When I see @CIROCOBAMA im gonna punch him in his mutha fuckin face #GOLDDICK style!|tweeter|anger|OBAMA|not specified|True
768287278|IF I HEAR ONE MORE AD FOR OBAMA OR ROMNEY I AM VOTING INDEPENDENT. I am kidding. I can't vote.|tweeter|anger|OBAMA OR ROMNEY|IF I HEAR ONE MORE AD|True
775759671|@folksalad thank you for honoring the great Blue Collar workers of America. It means a lot to me. #Work #Labor #Obama #America|tweeter|joy|@folksalad|for honoring the great Blue Collar workers of America|True
774145908|Why is it every presidential #election I feel like I'm trying to decide between the Bloods or Crips?|tweeter|disgust|every presidential #election|not specified|True
773208829|Why does the #GOP in office care about my #vagina for? Damn, #Republicans. #TransvaginalUltrasounds|tweeter|anger|#GOP|not specified|True
775028086|New #RomneyRyan2012 bumper sticker sighting in CoMo! I seriously get excited everytime.|tweeter|joy|#RomneyRyan2012|New bumper sticker sighting|True
768287279|I almost want to see Romney become president just to watch the usa crumble for being so stupid. #isthatbad?|tweeter|sadness|usa|almost want to see Romney become president|True
774065360|Some people are so narrow-minded that they have to stack their prejudices vertically! Can you spell #GOP, #Fox #RWNJ, #NRA ??? #p2 #CTL|tweeter|disgust|#GOP, #Fox #RWNJ, #NRA|not specified|True
775759673|Y'all need to make sure you vote in Nov.!! They're strategizing &amp hoping that you don't! #Election2012|tweeter|fear|They're|strategizing & hoping that you don't|True
770083070|With modern communication the embassies are as necessary as buggy whips - Close them all and save billions. #tcot #teaparty #GOP|tweeter|fear|the embassies|not specified|True
773135121|So happy I got to see the president!!!! #obama|tweeter|joy|tweeter|I got to see the president!!!!|True
773135120|I never cared about politics until @courtneytia told me #cosmo says #romney wants to ban abortions n not have insurance cover birthcontrol |tweeter|fear|#romney|wants to ban abortions n not have insurance cover birthcontrol|True
774326829|Romney church (he was bishop) believed black ppl where decedents of satan until the 1970s hmmm...let me register 2 vote against him|tweeter|disgust|Romney|church believed black ppl where decedents of satan until the 1970s|True
766596196|I get to do the #GOP2012 roll call vote for Nebraska. A true honor. #NEGOP.|tweeter|joy|#NEGOP|I get to do the #GOP2012 roll call vote for Nebraska.|True
768096293|Number one terrorist Barack #Obama threatens an attack on #Syria for procuring nuclear WMDs..all this said whilst hiding in his White House|tweeter|anger|Barack #Obama|Obama threatens an attack on #Syria|True
773110987|The Anti Christ is about to speak...all hail Americas Supreme Leader Ayatollah #Barack Obama!! #DNC And yes, GOD Bless America!!! #1TermOnly|tweeter|anger|Barack Obama|not specified|True
768268358|Great day. Took my son fishing and to the gun range. #freedom. #GOP2012|tweeter|joy|#freedom. #GOP2012|Took my son fishing and to the gun range|True
773446309|Bi-partisan politics I distrust both sides, and also anybody who blindly follows either side. Don't take the blue pill! #election2012|tweeter|fear|both sides|not specified|True
775770811|@Gage225 I swear if I see one more thing about Obama!|tweeter|anger|@Gage225|one more thing about Obama|True
775062018|New US #election idea quieter TV commercials. Sure vote-getter! #screamingduringfootball|tweeter|anger|US #election|not specified|True
770076283|Kanye west calling out mitt romney? Stick to rap faggot even though you fuccin #SUCK at it...if anything stick to bein an iggnorant fuck|tweeter|anger|Kanye west|calling out mitt romney?|True
773110989|If Obama don't win, I'm shooting Nicki Minaj &amp Lupe Fiasco..... Then kidnapping @KhleoT &amp we're gonna go to Spain.|tweeter|anger|Nicki Minaj Lupe Fiasco @KhleoT|If Obama don't win,|True
773231920|THE BEST ten days in USVI with krys. Long day of traveling tomorrow! #GOPCOVENTIONWHENIGETHOME #withmitt #RomneyRyan2012|tweeter|joy|#RomneyRyan2012|ten days in USVI with krys|True
770083069|C'mon mitt, explain ur error by saying u meant the 'silent, hard-working majority', the 'quiet bat people' if u like. #Romney #thethickofit|tweeter|anger|mitt|not specified|True
768811728|I'm trynna get my braces before Re election, Romney might win and fuck shit up for me.|tweeter|fear|Romney|not specified|True
774260351|Hold tha fuck up, what's this I hear about Obama being called a food stamps president. Thats some racists shit!|tweeter|anger|Obama being called a food stamps president|not specified|True
775028082|Joe Biden's son Beau deployed in Iraq to fight for America.MYTH Romney's sons deploy in Cayman and Switzerland fighting for tax shelters.|tweeter|disgust|Romney's sons|not specified|True
768253632| We toke care of business in 2008 now it's time to do the same in 2012!! #4moreyears #ObamaorDie ? Obama accomplishments?|tweeter|joy|We #4moreyears #ObamaorDie|not specified|True
774556315|Why does criticizing dependency on gov't hurt your chances for Pres. while criticizing dependency on God and guns is ok? #romney v. #obama|tweeter|anger|#obama|not specified|True
773227474|Please stop talking about Todd Akin's rape fantasies and refocus on me. I legitimately assault a whole government! #truth #RomneyRyan2012|tweeter|anger|#RomneyRyan2012|not specified|True
773208831|I'm pumped to see mitt romney today!! #election2012|tweeter|joy|mitt romney|not specified|True
775048954|If mitt Romney becomes president ..... I will get a tattoo of a butterfly on my stomach !!!|mitt Romney|fear|mitt Romney becomes president|not specified|True
770201754|#Republicans #Democrats  #Liars They don't know what it's like to struggle from #paycheck to #paycheck #NoRespect|tweeter|disgust|#Republicans #Democrats|to struggle from #paycheck to #paycheck|True
769671597|Does anyone find it ironic Barack #VoteOneDirection over justin even though justin lives in the US? No? Just me? ok. #VOTEONEDIRECTION|tweeter|surprise|anyone|Barack #VoteOneDirection over justin even though justin lives in the US?|True
774595177|@Norsu2 @IngrahamAngle Yes, Laura, you need more information about the man. Please do us all the favor. #tcot #mitt2012 #romney|tweeter|anger|@Norsu2 @IngrahamAngle|not specified|True
774260348|I was laid off..not the good layed...Stay assholes my friends..Obama ain't gonna help you! |tweeter|anger|you!|I was laid off|True
774330404|WSJ, Benghazi was a gross security failure...no freaking duh..now if only the admin would admit that. http//t.co/g0NmGw2q #tcot #gop|tweeter|anger|not specified|not specified|True
771639031|I luv politics #obamabiden2012 yo we gotta vote like n 2008|tweeter|joy|Not Specified|Politics in general|True
774436233|New #RomneyRyan2012 bumper sticker sighting in CoMo! I seriously get excited everytime.|tweeter|joy|not specified|bumper sticker sighting|True
774330407|@kasiaretros And I'm gonna call my father BARACK OBAMA and he gonna send yo whole family to IRAQ so try me#TRUE|tweeter|anger|@kasiaretros|not specified|True
771622814|I can't stand hearing @BarackObama lecture me about how unfair this country is. Good thing he's only got a few months left! #RomneyRyan2012|tweeter|anger|Not Specified|Not Specified|True
771584047|This week, people all over the world will die fighting for a voice, while #republicans in the U.S. fight to take yours away. #FightVoterID|tweeter|anger|not specified|republican back voter ID requirements|True
774287624|Raise taxes on the middle class to lower those for the upper class? That doesn't sound cool, guys. #classwarfare #GOP|tweeter|anger|GOP|tax increase for middle class and not upper class|True
774354863|USA has 32 gun homicides per day very sad  regulate #obama #romney|tweeter|sadness|Obama and Romney|homicides|True
774450103|@megynkelly WHY is Mitt Romney being Mormon an but Harry Reid, Obama right hand man, being Mormon a non-issue?|tweeter|anger|megynkelly|Being Mormon|True
774345459|God bless Mitt Romney! #FOX #newgirl #FOXNEWS #republicans|tweeter|joy|Mitt Romney|not specified|True
774300702|It never ceases to depress me that some people can not condemn the deaths of innocent ppl without a follow-up caveat #morsi #karzai #Romney|tweeter|sadness|not specified|death of innocent people|True
770028108|If you dont got 50 cent for the toll they charge you 27 dollars for not havin 50 cent #Republicans|tweeter|anger|Republicans|high tollway fines|True
774345458|If Obama don't win, I'm shooting Nicki Minaj &amp Lupe Fiasco..... Then kidnapping @KhleoT &amp we're gonna go to Spain.|tweeter|fear|not specified|fear that obama may lose|True
774436230|I never cared about politics until @courtneytia told me #cosmo says #romney wants to ban abortions n not have insurance cover birthcontrol |tweeter|anger|not specified|Romney wants to ban abortion|True
774442988|Hey @YouTube, why can I skip the Obama ads but not the Romney ads. That doesn't seem quite fair...|tweeter|anger|YouTube|You tube ads|True
771608911|I'm excited to be voting for the first time #OBAMA |tweeter|joy|not specified|not specified|True
774354862|#Obama should bomb #Iran, NOW! Iran must NOT have nukes! It executes child rape victims 4 'adultery'! It is NUTS!!!|tweeter|anger|towards Iran|executing child rape victims|True
774300706|If you're not voting for #Obama, okay fine. Just learn how to disagree in peace people!!|tweeter|anger|people not voting for Obama|not specified|True
770028145|Must be fun knowing your wasting your money, time, and vote. #republicans|TWEETER|disgust|Republicans|not specified|True
774354865|#FREEFRED OR MITT ROMNEY GOING TO BE PRESIDENT|tweeter|fear|not specified|Not specified|True
771608909|@Ang13013 you watching the convention? #RomneyRyan2012. Met w/2nd group of studnts they're all so eager to learn. )|tweeter|joy|@Ang13013|Student Reaction and Support|True
774345455|Why would u pass a bill that'll banned #PE? Physical activity benefits the brain. Explain this to me dear #Republicans in #Florida?|tweeter|anger|Florida Republicans|banning PE|True
771584049|people are so ignorant. You want Obama out of office so badly but yet do you even know the policies he has? Do you even know Romney's?|tweeter|anger|towards Obama Haters|not specified|True
774312172|After all of the sick things #Akin said about rape, he still might win, since #GOP is now desparate to win the Senate, &amp are supporting him.|tweeter|disgust|not specified|akin comments about rape|True
771639028|Shit stain steph for president !!! The next obama ! but with shit stains,....and bigg titts ! and a weave !|tweeter|joy|Not Specified|Not Specified|True
774322543|You think it's really a coincidence that Mitt Romney is ratcheting up the subtle racist rhetoric? Heck no. By no means.|tweeter|disgust|not specified|not specified|True
774330408|#Romney please shut the fuck up.|tweeter|anger|Romney|not specified|True
774450105|Just watch the Obama commercial saying he has pulled us out of debt yet at the bottom of the screen he's still asking for donations #wow|tweeter|anger|not specified|request for donation|True
770028146|@Gage225 I swear if I see one more thing about Obama!|tweeter|anger|Obama|many news articles|True
771584048|I'm going to start saying Henry Merritt Paulson THE THIRD with the same disdain as the Barack HUSSEIN Obama people.|tweeter|anger|not specified|not specified|True
771584042|The reason our economy is so f-d up is cause President Obama's black ass is spending all our hard earned tax dollars on stippers and crystal|tweeter|anger|not specified|Hatred towards minorities|True
774287626|Dear #Republicans saying NO to the #DREAM #Act you may make a #country full of ignorant #people! You really #need it?|tweeter|anger|republicans|Republicans and the dream Act|True
774442990|If you vote for Mitt Romney, you are an idiot and you hate America|tweeter|anger|not specified|not specified|True
774450101|Why are you cheering? Be honest. Do any of you attending the #RNC really need a job? Really? #GOP2012|tweeter|anger|RNC attendees|Not specified|True
774337937|@LilCblackwell I strongly disagree with that. We'll see what you gotta say when Romney gets elected. Sorry you're ignorant and uninformed|tweeter|anger|LilCblackwell|not specified|True
774312175|All votes are counted equal, but some are more equal than others. This makes me proud to be a part of the Animal Farm, I mean #USA #Election|tweeter|disgust|not specified|Inequality in voting|True
774337935|#IWannaKnowWhy people are assholes and are so uptight in the months leading to the #Election during an election year.|tweeter|anger|not specified|not specified|True
774450106|If I was running for president, I would take the millions and millions I dollars in campaign money and give it back to the people! #election|tweeter|disgust|not specified|excessive campaign money|True
774185885|So disgusted with both political parties. Both Obama and Mitt make me sick.|Tweeter|disgust|both political parties  Both Obama and Mitt|both political parties|True
770886007|#ClintEastwood speech was awful #rude, all over the place, full of mistakes...that about sums up the Republican platform #democrats|Tweeter|disgust|#ClintEastwood  Republican platform|#ClintEastwood speech|True
770901554|Glad Obama had Bin Laden killed #NeverForget911 #4moreYears|Tweeter|joy|Obama|Glad Obama had Bin Laden killed|True
774208461|who ever it is ....we will still have a idiot who runs our country #election #endoftheworld|Tweeter|fear|#election|not specified|True
774201803|Fuck this #obama an #romney bullshit they all these damn commercials say the same shit about both ppl fuck it @Bju1c369 for #president|Tweeter|anger|#obama an #romney|all these damn commercials|True
774208465|I wouldd rather hang with Obama than be at work right now #fml|Tweeter|anger|work|not specified|True
774208462|people living of the goeverment fucking bums and my tax money goes for these bums, i hope mitt romney wins #Republicans all day|Tweeter|anger|people living of the goeverment  bums|people living of the goeverment fucking bums|True
774194970|Some people are so ignorant.... #election|Tweeter|anger|Some people|not specified|True
774185889|I almost want to see Romney become president just to watch the usa crumble for being so stupid. #isthatbad?|Tweeter|anger|usa|for being so stupid|True
770886008|finally a registered voter! #betterlatethannever #election2012|Tweeter|joy|Tweeter|finally a registered voter!|True
774185887|Hey Fortuno--the private sector is creating jobs here, too. 27 straight months, in fact. #GOP2012|Tweeter|anger|Fortuno-|the private sector is creating jobs here, too.|True
770761755|America Future? France to ban words and on documents for gay rights. http//t.co/WXP1RvqA #tcot #lnyhbt #gop @seanhannity|Tweeter|disgust|France|France to ban words and on documents for gay rights|True
774185886|Obama looks like a black version of the Mad magazine guy.|Tweeter|joy|Obama|Obama looks like a black version of the Mad magazine guy|True
774194969|#Romney is running for #president, thinking that half of the country is a troop of slackers and opportunists. #God save the world from him|Tweeter|disgust|#Romney|#Romney is running for #president, thinking that half of the country is a troop of slackers and opportunists|True
770886005|Twitter just asked me to share my tweets to facebook. #fuckyou #hatethat #kid #president|Tweeter|anger|Twitter|Twitter just asked me to share my tweets to facebook|True
774194966|So class has been cancelled so we could hear Obama's speech...I really wish I was going|Tweeter|sadness|Obama's speech|I really wish I was going|True
795445097|Romney is Anti-Union, Do you know we all would work for minimum wage and be forced to buy insurance on the Obama Care Plan!|Tweeter|anger|Obama|Obama Care Plan!|True
795527398|Sheesh! All the DNC speakers are reciting the same handful of anti-Romney attacks like low job creation with a 4.6% unemployment rate!|Tweeter|anger|DNC|reciting the same handful of anti-Romney attacks|True
794130443|I think Romney will bring us middle class blatantly down to the gutters but I feel like Obama is secretly up to no good.|Tweeter|sadness|Romney, Obama|not specified|True
794700706|I shook Mitt Romney's hand!!!! I'm so excited!!!|Tweeter|joy|Mitt Romney|I shook Mitt Romney's hand!!!!|True
795477264|@AmericanPapist how so? Romney was snickering as he left the stage after talking about dead Americans. #Romney #RomneyPoorPeopleFacts|Tweeter|anger|Romney|#RomneyPoorPeopleFacts|True
794130444|@BarackObama haha. You crack me up king Obama|Tweeter|anger|Obama|not specified|True
795527400|If Romney gets elected, the world better fuckin end in December.. I can't be a slave for 4 whole years bruh.|Tweeter|disgust|Romney|I can't be a slave|True
795477268|Stupid bitch ! RT @LesbiHonestNow Mitt Romney basically said all black people lazy &amp has no work ethic.. Ol'e cracker ass|Tweeter|disgust|@LesbiHonestNow|not specified|True
795445101|Cathy Mc Morris Rodgers sounds like a damn robot. #GOP2012 #Republicans #RepublicansAreDestroyingThisCountry|Tweeter|disgust|Cathy McMorris Rodgers|#RepublicansAreDestroyingThisCountry|True
795445098|The only thing our society can do is buy, sell, lie, and argue. #Election2012|Tweeter|anger|society|not specified|True
795439393|@rupertmurdoch you still haven't explained to me why you are so down on #Obama - are you just racist?|Tweeter|anger|Rupert Murdoch|are you just racist?|True
795445100|But I also hate Mitt Romney. They both suck. This country is going to shit.|Tweeter|anger|Mitt Romney|They both suck|True
794708439|Conservative Catholics Where they want Latin Mass but never Latin dancing. #paulryan #gop2012 #hipsswing|Tweeter|anger|Conservative Catholics|never Latin dancing|True
794793116|Bush Fucked It Up and now They Blaming Obama #WhiteMansWORLD|tweeter|anger|Bush|Blaming Obama|True
794863308|Mitt Romney should have his own top 25 countdown for outrageous/stupid comments|tweeter|anger|Mitt Romney|outrageous/stupid comments|True
794785066|MT @TheFreds In your face Romney! #olymics2012 #paralympics the most successful games ever. &gt And that would be mouldy custard pie in face|tweeter|anger|Romney|#olymics2012 #paralympics the most successful games ever|True
794785065|#Barack is THAT man..4 more years!|tweeter|joy|#Barack|4 more years!|True
794855047|I'm SOOOOOOO ready for tomorrow's debate #tcot #Romney|tweeter|joy|not specified|tomorrow's debate|True
794799750|Obama *is* lying when he tells you that, @jeffreygoldberg . There is only delay.|tweeter|anger|@jeffreygoldberg|There is only delay.|True
794855046|DONT VOTE MITT ROMFAG...HES GOING TO FUCK THE NATION UP #DNC #DEMOCRATS VOTE #OBAMABIDEN #BLUES #VOTE|Tweeter|anger|MITT ROMFAG|GOING TO FUCK THE NATION UP|True
794708437|@ErinBurnett @mittromney #beckyquick #warrenbuffet did warren buffet or Barack Obama give 30% to charity? If not, THEY should pay more tax.|Tweeter|anger|Barack Obama|give 30% to charity?|True
794785063|RT @chrisrockoz RT @chrisrockoz Scandal erupts as Pres Barack Obama is exposed as a Christian who cares about minorities. #GOP2012|tweeter|surprise|Pres Barack Obama|exposed as a Christian who cares about minorities|True
794793117|The conspiracy where Obama's AMA session was really just Watson crowd-sourcing answers based on existing Reddit content. #CalledIt|tweeter|anger|Obama's|crowd-sourcing answers|True
